movie,genre,runtime,certificate,rating,stars,description,votes,director
Little Women,Drama            ,180 min,,7.2,"['Maya Hawke, ', 'Kathryn Newton, ', 'Dylan Baker, ', 'Willa Fitzgerald', '']","Dramatization of Louisa May Alcott's novel about the lives of the four March sisters during the American Civil War as they learn to navigate love, loss, and the trials of growing up.","4,598",
On Golden Pond,Drama            ,109 min,UA,7.6,"['Katharine Hepburn, ', 'Henry Fonda, ', 'Jane Fonda, ', 'Doug McKeon', '']","Norman is a curmudgeon with an estranged relationship with his daughter Chelsea. At Golden Pond, he and his wife nevertheless agree to care for Billy, the son of Chelsea's new boyfriend, and a most unexpected relationship blooms.",$119.29M,['Mark Rydell']
Honey Boy,Drama            ,94 min,R,7.2,"['Shia LaBeouf, ', 'Lucas Hedges, ', 'Noah Jupe, ', 'Byron Bowers', '']",A young actor's stormy childhood and early adult years as he struggles to reconcile with his father and deal with his mental health.,"39,601","[""Alma Har'el""]"
8½,Drama            ,138 min,,8,"['Marcello Mastroianni, ', 'Anouk Aimée, ', 'Claudia Cardinale, ', 'Sandra Milo', '']",A harried movie director retreats into his memories and fantasies.,$0.05M,['Federico Fellini']
I May Destroy You,Drama            ,30 min,18,8.1,"['Michaela Coel, ', 'Weruche Opia, ', 'Paapa Essiedu, ', 'Stephen Wight', '']","The question of sexual consent in contemporary life and how, in the new landscape of dating and relationships, we make the distinction between liberation and exploitation.","24,415",
Miss Sloane,Drama            ,132 min,UA,7.5,"['Jessica Chastain, ', 'Mark Strong, ', 'Gugu Mbatha-Raw, ', 'Michael Stuhlbarg', '']","In the high-stakes world of political power-brokers, Elizabeth Sloane is the most sought after and formidable lobbyist in D.C. But when taking on the most powerful opponent of her career, she finds winning may come at too high a price.",$3.50M,['John Madden']
The Long Home,Drama            ,96 min,R,,"['Josh Hartnett, ', 'Lio Tipton, ', 'Josh Hutcherson, ', 'James Franco', '']",A young contractor is hired to build a honky-tonk in Tennessee by the man who killed his father.,,['James Franco']
À ma soeur!,Drama            ,95 min,,6.4,"['Anaïs Reboux, ', 'Roxane Mesquida, ', 'Libero De Rienzo, ', 'Arsinée Khanjian', '']",Two sisters confront their sexual attitudes and experiences while on a family holiday.,$0.72M,['Catherine Breillat']
Anatomie de l'enfer,Drama            ,77 min,,4.4,"['Amira Casar, ', 'Rocco Siffredi, ', 'Alexandre Belin, ', 'Manuel Taglang', '']","A woman employs a gay man to spend four nights at her house to watch her when she's ""unwatchable"".","5,910",['Catherine Breillat']
Baby,Drama            ,50 min,18,6.8,"['Benedetta Porcaroli, ', 'Alice Pagani, ', 'Riccardo Mandolini, ', 'Chabeli Sastre', '']","A coming-of-age story that explores the unseen lives of Roman high schoolers. Loosely inspired by a true story, the series follows a group of Parioli teenagers as they defy society in their search for identity and independence","12,397",
Taps,Drama            ,126 min,U,6.7,"['George C. Scott, ', 'Timothy Hutton, ', 'Ronny Cox, ', 'Sean Penn', '']",Military cadets take extreme measures to ensure the future of their academy when its existence is threatened by local condo developers.,$35.86M,['Harold Becker']
L.A. Law,Drama            ,46 min,,7.1,"['Corbin Bernsen, ', 'Jill Eikenberry, ', 'Alan Rachins, ', 'Michael Tucker', '']",The lives and work of the staff of a major Los Angeles law firm.,"5,919",
War Pony,Drama            ,115 min,R,7.1,"['Iona Red Bear, ', 'Ta-Yamni Long Black Cat, ', 'Wilma Colhof, ', 'Jeremy Corbin Cottier', '']",The interlocking stories of two young Oglala Lakota men growing up on the Pine Ridge Reservation.,"1,386",
Yargi,Drama            ,150 min,,8.3,"['Kaan Urgancioglu, ', 'Pinar Deniz, ', 'Hüseyin Avni Danyal, ', 'Zeyno Eracar', '']","A lawyer and a prosecutor, whose paths cross with a murder case, will have to work together to find the murderer, and this will create an irreversible breaking point in their lives.","4,274",
Secret Diary of a Call Girl,Drama            ,30 min,,7.3,"['Billie Piper, ', 'Iddo Goldberg, ', 'Cherie Lunghi, ', 'Ashley Madekwe', '']",Based on the popular diary of the anonymous sex worker known only as Belle de Jour.,"13,974",
Le bleu du caftan,Drama            ,122 min,,7.6,"['Lubna Azabal, ', 'Saleh Bakri, ', 'Ayoub Missioui, ', 'Mounia Lamkimel', '']",A middle-aged tailor and his wife find their relationship turned upside down by the arrival of a handsome new apprentice.,"3,095",['Maryam Touzani']
Savage Grace,Drama            ,97 min,,5.7,"['Julianne Moore, ', 'Eddie Redmayne, ', 'Stephen Dillane, ', 'Anne Reid', '']","A dramatization of the shocking Barbara Daly Baekeland murder case, which happened in a posh London flat on Friday 17 November 1972. The bloody crime caused a stir on both sides of the Atlantic and remains one of the most memorable American Tragedies...",$0.43M,['Tom Kalin']
Nowhere Special,Drama            ,96 min,,7.4,"['James Norton, ', 'Daniel Lamont, ', 'Carol Moore, ', 'Valene Kane', '']","When John, a thirty-five-year-old window cleaner, is given only a few months to live, he attempts to find a new, perfect family for his three-year-old son, determined to shield him from the terrible reality of the situation.","5,512",['Uberto Pasolini']
Code Black,Drama            ,42 min,,8,"['Marcia Gay Harden, ', 'Harry Ford, ', 'Benjamin Hollingsworth, ', 'Luis Guzmán', '']",The staff of the L.A. County Hospital emergency room treats patients under difficult circumstances.,"12,767",
Große Freiheit,Drama            ,116 min,,7.5,"['Franz Rogowski, ', 'Georg Friedrich, ', 'Anton von Lucke, ', 'Thomas Prenn', '']","In post-war Germany, liberation by the Allies does not mean freedom for everyone. Hans is repeatedly imprisoned under Paragraph 175, which criminalizes homosexuality. Over the decades, he develops an unlikely bond with his cellmate Viktor.","6,150",['Sebastian Meise']
È stata la mano di Dio,Drama            ,130 min,18,7.3,"['Filippo Scotti, ', 'Toni Servillo, ', 'Teresa Saponangelo, ', 'Marlon Joubert', '']","In 1980s Naples, young Fabietto pursues his love for football as family tragedy strikes, shaping his uncertain but promising future as a filmmaker.","46,690",['Paolo Sorrentino']
Five Easy Pieces,Drama            ,98 min,U,7.4,"['Jack Nicholson, ', 'Karen Black, ', 'Billy Green Bush, ', 'Fannie Flagg', '']","A dropout from upper-class America picks up work along the way on oil rigs when his life isn't spent in a squalid succession of bars, motels, and other points of interest.",$19.40M,['Bob Rafelson']
Vernost,Drama            ,82 min,,5.7,"['Evgeniya Gromova, ', 'Aleksandr Pal, ', 'Marina Vasileva, ', 'Aleksey Agranovich', '']","Midwife Lena, a loving wife, is driven towards a string of infidelities after her husband continues to neglect her.","2,558",['Nigina Sayfullaeva']
Gravesend,Drama            ,,,6.1,"['William DeMeo, ', ""Joseph D'Onofrio, "", 'Christopher Mormando, ', 'Sofia Milos', '']","A 1980's series of events revolving around Benny Zerletta (William DeMeo), a Brooklyn based Italian-American, soldier in the Colezzo crime family. Benny depicts the difficulties that he ...                See full summary »
",256,
All About Eve,Drama            ,138 min,,8.2,"['Bette Davis, ', 'Anne Baxter, ', 'George Sanders, ', 'Celeste Holm', '']",A seemingly timid but secretly ruthless ingénue insinuates herself into the lives of an aging Broadway star and her circle of theater friends.,$0.01M,['Joseph L. Mankiewicz']
Aristotle and Dante Discover the Secrets of the Universe,Drama            ,96 min,PG-13,7.4,"['Luna Blaise, ', 'Eva Longoria, ', 'Kevin Alejandro, ', 'Eugenio Derbez', '']","Based on the book by Benjamin Alire Sáenz, set in 1987 El Paso, it's the tale of two teenage Mexican-American loners as they explore their friendship and the difficult road to self-discovery.",184,['Aitch Alberto']
Tierra de esperanza,Drama            ,60 min,,9,"['Carolina Miranda, ', 'Andrés Palacios, ', 'Luis Roberto Guzmán, ', 'Mariana Seoane', '']","Add a Plot
",81,
Maryland,Drama            ,47 min,,6.5,"['Suranne Jones, ', 'Eve Best, ', 'Stockard Channing, ', 'Hugh Quarshie', '']","Follows Becca and Rosaline, two sisters that were distanced, but that through tragic events, learn to love and respect each other again.",953,
Breaking the Waves,Drama            ,159 min,R,7.8,"['Emily Watson, ', 'Stellan Skarsgård, ', 'Katrin Cartlidge, ', 'Jean-Marc Barr', '']","Oilman Jan is paralyzed in an accident. His wife, who prayed for his return, feels guilty; even more, when Jan urges her to have sex with another.",$4.04M,['Lars von Trier']
Mildred Pierce,Drama            ,336 min,,7.6,"['Kate Winslet, ', 'Guy Pearce, ', 'Evan Rachel Wood, ', ""Brían F. O'Byrne"", '']","Divorced single mom Mildred Pierce decides to open a restaurant business, which tears at the already-strained relationship with her ambitious elder daughter, Veda.","22,934",
The Kashmir Files,Drama            ,170 min,A,8.7,"['Mithun Chakraborty, ', 'Anupam Kher, ', 'Darshan Kumaar, ', 'Pallavi Joshi', '']","A heart-wrenching tale that captures the pain, suffering, and struggle of the Kashmiri Pandit community in 1990 and leads Krishna, a young college student, to set out on a quest to uncover the truth.","5,70,600",['Vivek Agnihotri']
"My Sailor, My Love",Drama            ,103 min,,7.1,"['James Cosmo, ', 'Brid Brennan, ', 'Catherine Walker, ', 'Nora-Jane Noone', '']",A retired sea captain and his daughter must reassess their strained relationship after he begins a new romance with a widowed housekeeper.,442,['Klaus Härö']
Banshee Origins,Drama            ,,,8.6,"['Frankie Faison, ', 'Antony Starr, ', 'Ivana Milicevic, ', 'Ulrich Thomsen', '']","Fresh out of prison after 15 years, a master thief assumes the identity of a dead sheriff in Banshee, PA. After tracking down the woman he loves they try to avoid detection from her father; a Ukrainian mobster looking to kill them for double crossing him.","5,401",
Boze Cialo,Drama            ,115 min,,7.7,"['Bartosz Bielenia, ', 'Aleksandra Konieczna, ', 'Eliza Rycembel, ', 'Tomasz Zietek', '']","Daniel experiences a spiritual transformation in a detention center. Although his criminal record prevents him from applying to the seminary, he has no intention of giving up his dream and decides to minister a small-town parish.","20,542",['Jan Komasa']
Histoire d'O,Drama            ,105 min,A,5.3,"['Corinne Cléry, ', 'Udo Kier, ', 'Anthony Steel, ', 'Jean Gaven', '']","Photographer O's lover takes her to a Château, where she is, like other women there, naked, humiliated by whipping, sexual abuse by men etc. When O leaves, her lover gives her to his much older step-brother.","6,691",['Just Jaeckin']
Lost Girls and Love Hotels,Drama            ,97 min,R,4.7,"['Alexandra Daddario, ', 'Takehiro Hira, ', 'Carice van Houten, ', 'Andrew Rothney', '']","Haunted by her past, an English teacher explores love and dust with a dashing yakuza gangster in Tokyo.","4,968",['William Olsson']
Magazine Dreams,Drama            ,124 min,,7,"['Jonathan Majors, ', 'Harrison Page, ', 'Harriet Sansom Harris, ', 'Haley Bennett', '']",A Black amateur bodybuilder struggles to find human connection in this exploration of celebrity and violence.,279,['Elijah Bynum']
The Absence of Eden,Drama            ,,,7.7,"['Zoe Saldana, ', 'Adria Arjona, ', 'Garrett Hedlund, ', 'Tom Waits', '']",An ICE Agent struggling with the moral dilemmas of border security and an undocumented woman fighting to escape a ruthless cartel cross paths and work together to save the life of an innocent girl.,21,['Marco Perego']
Hamlet,Drama            ,242 min,PG-13,7.7,"['Kenneth Branagh, ', 'Julie Christie, ', 'Derek Jacobi, ', 'Kate Winslet', '']","Hamlet, Prince of Denmark, returns home to find his father murdered and his mother remarrying the murderer, his uncle. Meanwhile, war is brewing.",$4.41M,['Kenneth Branagh']
Scarecrow,Drama            ,112 min,A,7.2,"['Gene Hackman, ', 'Al Pacino, ', 'Dorothy Tristan, ', 'Ann Wedgeworth', '']","An ex-con drifter with a penchant for brawling is amused by a homeless ex-sailor, so they partner up as they head east together.",$9.00M,['Jerry Schatzberg']
L'Événement,Drama            ,100 min,R,7.4,"['Anamaria Vartolomei, ', 'Kacey Mottet Klein, ', 'Luàna Bajrami, ', 'Louise Orry-Diquéro', '']","An adaptation of Annie Ernaux's novel of the same name, looking back on her experience with abortion when it was still illegal in France in the 1960s.","10,194",['Audrey Diwan']
Festen,Drama            ,105 min,R,8.1,"['Ulrich Thomsen, ', 'Henning Moritzen, ', 'Thomas Bo Larsen, ', 'Paprika Steen', '']","At Helge's 60th birthday party, some unpleasant family truths are revealed.",$1.65M,['Thomas Vinterberg']
Four Good Days,Drama            ,100 min,R,6.5,"['Mila Kunis, ', 'Carla Gallo, ', 'Glenn Close, ', 'Stephen Root', '']",A mother helps her daughter work through four crucial days of recovery from substance abuse.,"10,528",['Rodrigo García']
One Night in Miami...,Drama            ,114 min,18,7.1,"['Kingsley Ben-Adir, ', 'Eli Goree, ', 'Aldis Hodge, ', 'Leslie Odom Jr.', '']","A fictional account of one incredible night where icons Muhammad Ali, Malcolm X, Sam Cooke, and Jim Brown gathered discussing their roles in the Civil Rights Movement and cultural upheaval of the 60s.","33,386",['Regina King']
Passions,Drama            ,60 min,,5.9,"['Lindsay Hartley, ', 'McKenzie Westmore, ', 'Galen Gering, ', 'Juliet Mills', '']","In the world of power and money, the wealthy and powerful Crane family rule the town of Harmony from their mansion on Raven Hill.","5,027",
The Royals,Drama            ,42 min,UA 13+,7.4,"['Joan Collins, ', 'Alexandra Park, ', 'Elizabeth Hurley, ', 'William Moseley', '']",Drama about a fictional British royal family in modern-day London.,"13,744",
Alaska Daily,Drama            ,47 min,,7.6,"['Hilary Swank, ', 'Jeff Perry, ', 'Grace Dove, ', 'Meredith Holzman', '']",A journalist seeks a fresh start in Alaska working for a newspaper in Anchorage.,"8,710",
Dear Edward,Drama            ,50 min,A,7.2,"['Taylor Schilling, ', ""Colin O'Brien, "", 'Anna Uzele, ', 'Idris Debrand', '']","A 12-year-old boy becomes the lone survivor of a plane crash. As he and others affected by the tragedy try to make sense of what happened, unexpected friendships, romances, and communities are formed.","3,136",
Olive Kitteridge,Drama            ,239 min,,8.3,"['Frances McDormand, ', 'Richard Jenkins, ', 'Ann Dowd, ', 'Ken Cheeseman', '']",A middle-school math teacher Olive and her marriage with Henry which spans 25 years.,"24,534",
Exotica,Drama            ,103 min,A,7,"['Bruce Greenwood, ', 'Elias Koteas, ', 'Don McKellar, ', 'Mia Kirshner', '']","A man plagued by neuroses frequents the club Exotica in an attempt to find solace, but even there his past is never far away.",$4.18M,['Atom Egoyan']
Tales of the City,Drama            ,60 min,18,7.4,"['Laura Linney, ', 'Elliot Page, ', 'Paul Gross, ', 'Murray Bartlett', '']","A middle-aged Mary Ann returns to San Francisco and reunites with the eccentric friends she left behind. ""Tales of the City"" focuses primarily on the people who live in a boardinghouse turned apartment complex owned by Anna Madrigal at 28 Barbary Lane, all of whom quickly become part of what Maupin coined a ""logical family"". It's no longer a secret that Mrs. Madrigal is transgender. Instead, she ...                See full summary »
","8,670",
In Treatment,Drama            ,30 min,UA 16+,8.3,"['Gabriel Byrne, ', 'Uzo Aduba, ', 'Dianne Wiest, ', 'Michelle Forbes', '']","A psychotherapist questions his abilities and gets help by reuniting with his old therapist, whom he has not seen for ten years.","17,861",
Kadin,Drama            ,120 min,,6.7,"['Özge Özpirinçci, ', 'Seray Kaya, ', 'Kubra Suzgun, ', 'Ali Semi Sefil', '']","Bahar, a loving mother who struggles to maintain a life with her two children, must deal with life's challenges and uncover the hidden truths of the past.","1,496",
All Rise,Drama            ,44 min,,7,"['Simone Missick, ', 'Wilson Bethel, ', 'Jessica Camacho, ', 'J. Alex Brinson', '']","A look at the personal and professional lives of the judges, lawyers, clerks, bailiffs and cops who work at an L.A. County courthouse.","5,512",
East of Eden,Drama            ,118 min,U,7.8,"['James Dean, ', 'Raymond Massey, ', 'Julie Harris, ', 'Burl Ives', '']","Two brothers in 1910s California struggle to maintain their strict, Bible-toting father's favor as an old secret about their long-absent mother comes to light.","47,493",['Elia Kazan']
The Inspection,Drama            ,95 min,A,6.7,"['Jeremy Pope, ', 'Gabrielle Union, ', 'Bokeem Woodbine, ', 'Raúl Castillo', '']","A young, gay Black man, rejected by his mother and with few options for his future, decides to join the Marines, doing whatever it takes to succeed in a system that would cast him aside.","3,651",['Elegance Bratton']
To the Bone,Drama            ,107 min,,6.8,"['Rebekah Kennedy, ', 'Lily Collins, ', 'Dana L. Wilson, ', 'Ziah Colon', '']","A young woman, dealing with anorexia, meets an unconventional doctor who challenges her to face her condition and embrace life.","52,675",['Marti Noxon']
Deadlock,Drama            ,,,7.9,"['Luca Asta Sardelis, ', 'Bijou Gracie Henry, ', 'Thomas Weatherall, ', 'Amit Pala', '']","DEADLOCK crashes though the incredible highs, heartbreak, camaraderie, laughs, and bittersweet sorrow of what it is to be a teenager. When a mysterious car crash exposes the dark underbelly...                See full summary »
",58,
Baradaran-e Leila,Drama            ,165 min,,7.9,"['Saeed Poursamimi, ', 'Taraneh Alidoosti, ', 'Navid Mohammadzadeh, ', 'Payman Maadi', '']","Leila, who has spent her entire life caring for her family, makes a plan as her brothers are struggling to make ends meet.","10,371",['Saeed Roustayi']
The Cement Garden,Drama            ,105 min,,7,"['Charlotte Gainsbourg, ', 'Andrew Robertson, ', 'Alice Coulthard, ', 'Ned Birkin', '']","Four children live with their terminally ill mother. After she dies, they try to hold things together. In their isolated house, they begin to deteriorate mentally, whilst they hide their mom's decomposing corpse in a makeshift concrete sarcophagus.",$0.32M,['Andrew Birkin']
Short Term 12,Drama            ,96 min,R,7.9,"['Brie Larson, ', 'Frantz Turner, ', 'John Gallagher Jr., ', 'Kaitlyn Dever', '']",A 20-something supervising staff member of a residential treatment facility navigates the troubled waters of that world alongside her co-worker and longtime boyfriend.,$1.01M,['Destin Daniel Cretton']
Twilight's Child,Drama            ,,,7.7,"['Brec Bassinger, ', 'Khobe Clarke, ', 'Joey McIntyre, ', 'Donna Mills', '']","Dawn gets her baby daughter Christie back and prepares to marry Jimmy. But as she settles in as owner of the Cutler's Cove Resort, she's haunted by visions of Grandmother Cutler",47,['Jacquie Gould']
MVP,Drama            ,112 min,,6.8,"['Mo McRae, ', 'Nate Boyer, ', 'Christina Ochoa, ', 'Dina Shihabi', '']","On the streets of Hollywood, a recently retired NFL player is saved from scandal by a homeless veteran. With their ""glory days"" behind them, the two men bond in search of purpose and identity.",279,['Nate Boyer']
...One Third of a Nation...,Drama            ,79 min,,6.2,"['Sylvia Sidney, ', 'Leif Erickson, ', 'Myron McCormick, ', 'Hiram Sherman', '']","A fire in a run-down tenement building injures young Joey Rogers. Wealthy passerby Peter Cortlant rushes the boy and his attractive older sister Mary to the hospital and pays the medical ...                See full summary »
",293,['Dudley Murphy']
Fanny och Alexander,Drama            ,188 min,A,8.1,"['Bertil Guve, ', 'Pernilla Allwin, ', 'Kristina Adolphson, ', 'Börje Ahlstedt', '']","Two young Swedish children in the 1900s experience the many comedies and tragedies of their lively and affectionate theatrical family, the Ekdahls.",$4.97M,['Ingmar Bergman']
Partner Track,Drama            ,60 min,A,6.7,"['Arden Cho, ', 'Alexandra Turshen, ', 'Bradley Gibson, ', 'Dominic Sherwood', '']","Centers on Ingrid Yun, an idealistic young lawyer, struggles with her moral compass and her passions as she fights to climb the partner track at an elite New York City law firm.","6,774",
Vortex,Drama            ,142 min,,7.4,"['Dario Argento, ', 'Françoise Lebrun, ', 'Alex Lutz, ', 'Kylian Dheret', '']",The last days of an elderly couple stricken by dementia.,"7,888",['Gaspar Noé']
Stateless,Drama            ,316 min,16,7.5,"['Yvonne Strahovski, ', 'Jai Courtney, ', 'Asher Keddie, ', 'Fayssal Bazzi', '']","Inspired by true events; a woman escaping a cult, a refugee fleeing with his family, a father trapped in a dead-end job and a bureaucrat on the verge of a national scandal find their lives intertwined in an immigration detention center.","10,292",
The Secret Lives of Cheerleaders,Drama            ,87 min,,5.2,"['Denise Richards, ', 'Savannah Lee May, ', 'Alexandria DeBerry, ', 'Josie Davis', '']","A pretty and talented cheerleader, Ava, finds herself embroiled in a petty feud with a more popular and ruthless fellow cheerleader who wants nobody else stealing her spotlight.",447,['Peter Sullivan']
Farming,Drama            ,101 min,R,6.2,"['Leke Adebayo, ', 'Ademola Adedoyin, ', 'Adejola Adeyemi, ', 'Adewale Akinnuoye-Agbaje', '']","Based on the writer/director's childhood, FARMING tells story of a young Nigerian boy, 'farmed out' by his parents to a white British family in the hope of a better future. Instead, he becomes the feared leader of a white skinhead gang.","1,809",['Adewale Akinnuoye-Agbaje']
Ladri di biciclette,Drama            ,89 min,U,8.3,"['Lamberto Maggiorani, ', 'Enzo Staiola, ', 'Lianella Carell, ', 'Elena Altieri', '']","In post-war Italy, a working-class man's bicycle is stolen, endangering his efforts to find work. He and his son set out to find it.",$0.33M,['Vittorio De Sica']
Bloomington,Drama            ,83 min,,5.8,"['Allison McAtee, ', 'Sarah Stouffer, ', 'Katherine Ann McGregor, ', 'Ray Zupp', '']",A coming-of-age drama about a former child actress attending college in search of independence and who ends up becoming romantically involved with a female professor.,"5,625",['Fernanda Cardoso']
Klip,Drama            ,102 min,,5.6,"['Isidora Simijonovic, ', 'Vukasin Jasnic, ', 'Sanja Mikitisin, ', 'Jovo Maksic', '']","In the face of her family life falling to pieces, a social-media-obsessed teenage girl falls into a hedonistic world of sex, drugs, and abuse.","7,049",['Maja Milos']
Angela Black,Drama            ,,,6.4,"['Joanne Froggatt, ', 'Michiel Huisman, ', 'Samuel Adewunmi, ', 'Seth Stokes', '']","Trapped in a relationship she cannot escape, Angela is approached out of the blue by Ed, a private investigator, who spills her husband's darkest secrets.","3,392",
"Jeanne Dielman, 23 quai du Commerce, 1080 Bruxelles",Drama            ,202 min,,7.6,"['Delphine Seyrig, ', 'Jan Decorte, ', 'Henri Storck, ', 'Jacques Doniol-Valcroze', '']","A lonely widowed housewife does her daily chores, takes care of her apartment where she lives with her teenage son, and turns the occasional trick to make ends meet. However, something happens that changes her safe routine.",$0.02M,['Chantal Akerman']
Transplant,Drama            ,60 min,,7.9,"['Hamza Haq, ', 'Laurence Leboeuf, ', 'John Hannah, ', 'Ayisha Issa', '']","An ER doctor, who fled his native Syria to come to Canada, must overcome numerous obstacles to resume a career in the high stakes world of emergency medicine.","4,735",
Tôkyô monogatari,Drama            ,136 min,U,8.2,"['Chishû Ryû, ', 'Chieko Higashiyama, ', 'Sô Yamamura, ', 'Setsuko Hara', '']","An old couple visit their children and grandchildren in the city, but receive little attention.","64,975",['Yasujirô Ozu']
The Way Home,Drama            ,42 min,,7.9,"['Chyler Leigh, ', 'Evan Williams, ', 'Sadie Laflamme-Snow, ', 'Andie MacDowell', '']",Three generations of strong and independent women living together in the small farm town of Port Haven embark on an enlightening journey none of them could have imagined as they learn how to find their way back to each other.,"1,542",
God's Creatures,Drama            ,100 min,R,6,"['Seán T. Ó Meallaigh, ', 'Paul Mescal, ', 'Emily Watson, ', 'Declan Conlon', '']","In a windswept fishing village, a mother is torn between protecting her beloved son and her own sense of right and wrong. A lie she tells for him rips apart their family and close-knit community in this tense, sweepingly emotional epic.","2,519",
The Grapes of Wrath,Drama            ,129 min,,8.1,"['Henry Fonda, ', 'Jane Darwell, ', 'John Carradine, ', 'Charley Grapewin', '']","An Oklahoma family, driven off their farm by the poverty and hopelessness of the Dust Bowl, joins the westward migration to California, suffering the misfortunes of the homeless in the Great Depression.",$0.06M,['John Ford']
The Other Side of the Wind,Drama            ,122 min,R,6.7,"['John Huston, ', 'Oja Kodar, ', 'Peter Bogdanovich, ', 'Susan Strasberg', '']","At a media-swamped party to celebrate his 70th birthday and screen his avant-garde film-in-progress, a legendary but jaded Hollywood director is faced both with voracious fans and unsettling questions about what became of his lead actor.","7,765",['Orson Welles']
Vida,Drama            ,35 min,18,7.4,"['Melissa Barrera, ', 'Mishel Prada, ', 'Ser Anzoategui, ', 'Chelsea Rendon', '']","Two sisters, who could not be more different or distanced from each other, are forced to move back to their childhood neighborhood, after the death of their mother, only to discover her past and the shocking truth about her identity.","3,338",
