movie,genre,runtime,certificate,rating,stars,description,votes,director
The Sixth Commandment,Drama            ,,,8.1,"['Adrian Rawlins, ', 'Amanda Root, ', 'Conor MacNeill, ', 'Éanna Hardwicke', '']","Follows the deaths of Peter Farquhar and Ann Moore-Martin in the village of Maids Moreton, Buckinghamshire, and the extraordinary events that unfolded in the following years.","1,801",
The Shawshank Redemption,Drama            ,142 min,A,9.3,"['Tim Robbins, ', 'Morgan Freeman, ', 'Bob Gunton, ', 'William Sadler', '']","Over the course of several years, two convicts form a friendship, seeking consolation and, eventually, redemption through basic compassion.",$28.34M,['Frank Darabont']
Euphoria,Drama            ,55 min,A,8.3,"['Zendaya, ', 'Hunter Schafer, ', 'Jacob Elordi, ', 'Maude Apatow', '']","A look at life for a group of high school students as they grapple with issues of drugs, sex, and violence.","2,14,007",
The Good Doctor,Drama            ,41 min,15+,8,"['Freddie Highmore, ', 'Hill Harper, ', 'Richard Schiff, ', 'Christina Chang', '']","Shaun Murphy, a young surgeon with autism and Savant syndrome, is recruited into the surgical unit of a prestigious hospital.","1,05,685",
Billions,Drama            ,60 min,15+,8.4,"['Paul Giamatti, ', 'Damian Lewis, ', 'Maggie Siff, ', 'David Costabile', '']","New money means no mercy as Mike Prince takes the Axe Capital throne. Chuck Rhoades is convinced no one should have that much wealth - or power. As all the players seek out new alliances, only one thing's for certain - wealth means war.","99,042",
Fight Club,Drama            ,139 min,A,8.8,"['Brad Pitt, ', 'Edward Norton, ', 'Meat Loaf, ', 'Zach Grenier', '']",An insomniac office worker and a devil-may-care soap maker form an underground fight club that evolves into much more.,$37.03M,['David Fincher']
Mad Men,Drama            ,47 min,16+,8.7,"['Jon Hamm, ', 'Elisabeth Moss, ', 'Vincent Kartheiser, ', 'January Jones', '']","A drama about one of New York's most prestigious ad agencies at the beginning of the 1960s, focusing on one of the firm's most mysterious but extremely talented ad executives, Donald Draper.","2,50,518",
The Whale,Drama            ,117 min,A,7.7,"['Brendan Fraser, ', 'Sadie Sink, ', 'Ty Simpkins, ', 'Hong Chau', '']","A reclusive, morbidly obese English teacher attempts to reconnect with his estranged teenage daughter.","1,65,378",['Darren Aronofsky']
The Morning Show,Drama            ,60 min,15+,8.2,"['Jennifer Aniston, ', 'Reese Witherspoon, ', 'Billy Crudup, ', 'Mark Duplass', '']","An inside look at the lives of the people who help America wake up in the morning, exploring the unique challenges faced by the team.","1,11,773",
The Beauty Queen of Jerusalem,Drama            ,28 min,,7.3,"['Michael Aloni, ', 'Swell Ariel Or, ', 'Hila Saada, ', 'Irit Kaplan', '']","A family living through the Ottoman Empire, The British Mandate and Israel's War of Independence. The multi-generational historical melodrama will shoot across the country in Hebrew, English, Ladino and Arabic.","1,224",
American Beauty,Drama            ,122 min,UA,8.3,"['Kevin Spacey, ', 'Annette Bening, ', 'Thora Birch, ', 'Wes Bentley', '']",A sexually frustrated suburban father has a mid-life crisis after becoming infatuated with his daughter's best friend.,$130.10M,['Sam Mendes']
House of Cards,Drama            ,51 min,16+,8.7,"['Kevin Spacey, ', 'Michel Gill, ', 'Robin Wright, ', 'Kate Mara', '']",A Congressman works with his equally conniving wife to exact revenge on the people who betrayed him.,"5,17,957",
There Will Be Blood,Drama            ,158 min,A,8.2,"['Daniel Day-Lewis, ', 'Paul Dano, ', 'Ciarán Hinds, ', 'Martin Stringer', '']","A story of family, religion, hatred, oil and madness, focusing on a turn-of-the-century prospector in the early days of the business.",$40.22M,['Paul Thomas Anderson']
Requiem for a Dream,Drama            ,102 min,A,8.3,"['Ellen Burstyn, ', 'Jared Leto, ', 'Jennifer Connelly, ', 'Marlon Wayans', '']",The drug-induced utopias of four Coney Island people are shattered when their addictions run deep.,$3.64M,['Darren Aronofsky']
One Flew Over the Cuckoo's Nest,Drama            ,133 min,A,8.7,"['Jack Nicholson, ', 'Louise Fletcher, ', 'Michael Berryman, ', 'Peter Brocco', '']","In the Fall of 1963, a Korean War veteran and criminal pleads insanity and is admitted to a mental institution, where he rallies up the scared patients against the tyrannical nurse.",$112.00M,['Milos Forman']
Dawn,Drama            ,,,5.9,"['Brec Bassinger, ', 'Khobe Clarke, ', 'Donna Mills, ', 'Elyse Maloway', '']","Follows the dark, twisted history of Dawn Longchamp and her family, along with the Cutler and Booth families.",231,['Linda-Lisa Hayter']
Salò o le 120 giornate di Sodoma,Drama            ,117 min,A,5.8,"['Paolo Bonacelli, ', 'Giorgio Cataldi, ', 'Uberto Paolo Quintavalle, ', 'Aldo Valletti', '']","In World War II Italy, four fascist libertines round up nine adolescent boys and girls and subject them to 120 days of physical, mental, and sexual torture.","63,298",['Pier Paolo Pasolini']
The Passion of the Christ,Drama            ,127 min,A,7.2,"['Jim Caviezel, ', 'Monica Bellucci, ', 'Maia Morgenstern, ', 'Christo Jivkov', '']","Depicts the final twelve hours in the life of Jesus of Nazareth, on the day of his crucifixion in Jerusalem.",$370.78M,['Mel Gibson']
The Fabelmans,Drama            ,151 min,UA,7.6,"['Michelle Williams, ', 'Gabriel LaBelle, ', 'Paul Dano, ', 'Judd Hirsch', '']","Growing up in post-World War II era Arizona, young Sammy Fabelman aspires to become a filmmaker as he reaches adolescence, but soon discovers a shattering family secret and explores how the power of films can help him see the truth.","97,298",['Steven Spielberg']
Troy,Drama            ,163 min,UA,7.3,"['Brad Pitt, ', 'Eric Bana, ', 'Orlando Bloom, ', 'Julian Glover', '']","An adaptation of Homer's great epic, the film follows the assault on Troy by the united Greek forces and chronicles the fates of the men involved.",$133.38M,['Wolfgang Petersen']
Aftersun,Drama            ,102 min,R,7.7,"['Paul Mescal, ', 'Frankie Corio, ', 'Celia Rowlson-Hall, ', 'Sally Messham', '']",Sophie reflects on the shared joy and private melancholy of a holiday she took with her father twenty years earlier. Memories real and imagined fill the gaps between as she tries to reconcile the father she knew with the man she didn't...,"69,877",['Charlotte Wells']
The West Wing,Drama            ,44 min,,8.9,"['Martin Sheen, ', 'Rob Lowe, ', 'Allison Janney, ', 'John Spencer', '']",Inside the lives of staffers in the West Wing of the White House.,"81,414",
Chicago Med,Drama            ,43 min,UA 16+,7.6,"['Nick Gehlfuss, ', 'Marlyne Barrett, ', 'S. Epatha Merkerson, ', 'Oliver Platt', '']","The city's most highly skilled medical team saves lives, while navigating their unique interpersonal relationships.","27,648",
Kids,Drama            ,91 min,A,7,"['Leo Fitzpatrick, ', 'Justin Pierce, ', 'Chloë Sevigny, ', 'Sarah Henderson', '']","A day in the life of a group of teens as they travel around New York City skating, drinking, smoking and deflowering virgins.",$7.42M,['Larry Clark']
The Queen's Gambit,Drama            ,60 min,18,8.6,"['Anya Taylor-Joy, ', 'Chloe Pirrie, ', 'Bill Camp, ', 'Marcin Dorocinski', '']","Orphaned at the tender age of nine, prodigious introvert Beth Harmon discovers and masters the game of chess in 1960s USA. But child stardom comes at a price.","5,01,575",
Jagten,Drama            ,115 min,7,8.3,"['Mads Mikkelsen, ', 'Thomas Bo Larsen, ', 'Annika Wedderkopp, ', 'Lasse Fogelstrøm', '']","A teacher lives a lonely life, all the while struggling over his son's custody. His life slowly gets better as he finds love and receives good news from his son, but his new luck is about to be brutally shattered by an innocent little lie.",$0.69M,['Thomas Vinterberg']
New Amsterdam,Drama            ,43 min,Not Rated,8,"['Ryan Eggold, ', 'Janet Montgomery, ', 'Jocko Sims, ', 'Tyler Labine', '']",A new medical director breaks the rules to heal the system at America's oldest public hospital.,"45,961",
Drops of God,Drama            ,,A,8.1,"['Tomohisa Yamashita, ', 'Fleur Geffrier, ', 'Tom Wozniczka, ', 'Stanley Weber', '']",A woman discovers the world's greatest wine collection that's left by her estranged father and competes against his protege to claim her inheritance.,"5,964",
All the Queen's Men,Drama            ,43 min,,6.7,"['Eva Marcille, ', 'Racquel Palmer, ', 'Candace Maxwell, ', 'Oshea Russell', '']","Centers around the life of Marilyn 'Madam' DeVille. Madam is a fierce businesswoman who is at the top of her game in the nightclub industry and surrounded by a band of trusted employees who...                See full summary »
","1,663",
Minari,Drama            ,115 min,UA,7.4,"['Steven Yeun, ', 'Yeri Han, ', 'Alan Kim, ', 'Noel Cho', '']","A Korean American family moves to an Arkansas farm in search of its own American dream. Amidst the challenges of new life in the strange and rugged Ozarks, they discover the undeniable resilience of family and what really makes a home.","89,110",['Lee Isaac Chung']
The Chi,Drama            ,60 min,,7.6,"['Jason Mitchell, ', 'Jacob Latimore, ', 'Ntare Guma Mbaho Mwine, ', 'Alex R. Hibbert', '']","From Emmy® winner Lena Waithe, The Chi is a timely coming-of-age drama series centered on a group of residents who become linked by coincidence but bonded by the need for connection and redemption.","6,910",
Unspeakable,Drama            ,47 min,,5.8,"['Indira Varma, ', 'Luke Treadaway, ', 'Kate Ashfield, ', 'Neil Maskell', '']","A single mum receives an anonymous text message, claiming her new boyfriend is having an inappropriate relationship with her 11 year old daughter. Over one weekend the accusation fractures the relationship between the couple.",567,['David Nath']
The Swimmer,Drama            ,95 min,M/PG,7.6,"['Burt Lancaster, ', 'Janet Landgard, ', 'Janice Rule, ', 'Tony Bickley', '']",A man spends a summer day swimming as many pools as he can all over a quiet suburban town.,"12,858",
The Help,Drama            ,146 min,UA,8.1,"['Viola Davis, ', 'Emma Stone, ', 'Octavia Spencer, ', 'Bryce Dallas Howard', '']","An aspiring author during the civil rights movement of the 1960s decides to write a book detailing the African American maids' point of view on the white families for which they work, and the hardships they go through on a daily basis.",$169.71M,['Tate Taylor']
Nymphomaniac: Vol. I,Drama            ,117 min,Not Rated,6.9,"['Charlotte Gainsbourg, ', 'Stellan Skarsgård, ', 'Stacy Martin, ', 'Shia LaBeouf', '']",A self-diagnosed nymphomaniac recounts her erotic experiences to the man who saved her after a beating.,$0.79M,['Lars von Trier']
Pretty Baby,Drama            ,110 min,A,6.5,"['Brooke Shields, ', 'Keith Carradine, ', 'Susan Sarandon, ', 'Frances Faye', '']",A preteen girl lives as a prostitute in New Orleans in 1917.,$5.79M,['Louis Malle']
Druk,Drama            ,117 min,16,7.7,"['Mads Mikkelsen, ', 'Thomas Bo Larsen, ', 'Magnus Millang, ', 'Lars Ranthe', '']",Four high-school teachers consume alcohol on a daily basis to see how it affects their social and professional lives.,"1,77,928",['Thomas Vinterberg']
The Resident,Drama            ,60 min,15+,7.8,"['Matt Czuchry, ', 'Manish Dayal, ', 'Bruce Greenwood, ', 'Malcolm-Jamal Warner', '']",A group of doctors at Chastain Memorial Hospital face personal and professional challenges on a daily basis.,"29,588",
A Good Person,Drama            ,128 min,R,7,"['Florence Pugh, ', 'Morgan Freeman, ', ""Celeste O'Connor, "", 'Molly Shannon', '']","Follows Allison, whose life falls apart following her involvement in a fatal accident.","12,072",['Zach Braff']
Dopesick,Drama            ,492 min,18,8.6,"['Michael Keaton, ', 'Peter Sarsgaard, ', 'Michael Stuhlbarg, ', 'Will Poulter', '']","The series takes viewers to the epicenter of America's struggle with opioid addiction, from the boardrooms of Purdue Pharma, to a distressed Virginia mining community, to the hallways of the DEA.","66,117",
Boogie Nights,Drama            ,155 min,18,7.9,"['Mark Wahlberg, ', 'Julianne Moore, ', 'Burt Reynolds, ', 'Luis Guzmán', '']","Back when sex was safe, pleasure was a business and business was booming, an idealistic porn producer aspires to elevate his craft to an art when he discovers a hot young talent.",$26.40M,['Paul Thomas Anderson']
The Perks of Being a Wallflower,Drama            ,103 min,UA,7.9,"['Logan Lerman, ', 'Emma Watson, ', 'Ezra Miller, ', 'Paul Rudd', '']","Charlie, a 15-year-old introvert, enters high school and is nervous about his new life. When he befriends his seniors, he learns to cope with his friend's suicide and his tumultuous past.",$17.74M,['Stephen Chbosky']
The Fallout,Drama            ,96 min,A,7,"['Jenna Ortega, ', 'Maddie Ziegler, ', 'Niles Fitch, ', 'Will Ropp', '']","High schooler Vada navigates the emotional fallout she experiences in the wake of a school tragedy. Relationships with her family, friends and view of the world are forever altered.","29,401",['Megan Park']
Skins,Drama            ,46 min,UA,8.2,"['Kaya Scodelario, ', 'Nicholas Hoult, ', 'Joe Dempsie, ', 'Hannah Murray', '']",The story of a group of British teens who are trying to grow up and find love and happiness despite questionable parenting and teachers who would rather be friends (and lovers) than authority figures.,"89,208",
Rain Man,Drama            ,133 min,U,8,"['Dustin Hoffman, ', 'Tom Cruise, ', 'Valeria Golino, ', 'Gerald R. Molen', '']","After a selfish L.A. yuppie learns his estranged father left a fortune to an autistic-savant brother in Ohio that he didn't know existed, he absconds with his brother and sets out across the country, hoping to gain a larger inheritance.",$178.80M,['Barry Levinson']
Showgirls,Drama            ,128 min,A,5,"['Elizabeth Berkley, ', 'Kyle MacLachlan, ', 'Gina Gershon, ', 'Glenn Plummer', '']","Carefree young drifter Nomi arrives in Las Vegas, Nevada to become a dancer and sets about clawing her way to the top of the Vegas showgirls.",$20.30M,['Paul Verhoeven']
Last Summer,Drama            ,95 min,,6.9,"['Barbara Hershey, ', 'Richard Thomas, ', 'Bruce Davison, ', 'Catherine Burns', '']","During summer vacation on Fire Island, three young people become very close. When an uncool girl tries to infiltrate the trio's newly found relationship, they construct an elaborate plot that has violent results.",$2.37M,['Frank Perry']
Manchester by the Sea,Drama            ,137 min,UA,7.8,"['Casey Affleck, ', 'Michelle Williams, ', 'Kyle Chandler, ', 'Lucas Hedges', '']",A depressed uncle is asked to take care of his teenage nephew after the boy's father dies.,$47.70M,['Kenneth Lonergan']
Trainspotting,Drama            ,93 min,A,8.1,"['Ewan McGregor, ', 'Ewen Bremner, ', 'Jonny Lee Miller, ', 'Kevin McKidd', '']","Renton, deeply immersed in the Edinburgh drug scene, tries to clean up and get out, despite the allure of the drugs and influence of friends.",$16.50M,['Danny Boyle']
The Newsroom,Drama            ,55 min,15+,8.6,"['Jeff Daniels, ', 'Emily Mortimer, ', 'John Gallagher Jr., ', 'Alison Pill', '']","A newsroom undergoes some changes in its workings and morals as a new team is brought in, bringing unexpected results for its existing news anchor.","1,20,491",
Thirteen,Drama            ,100 min,15+,6.8,"['Evan Rachel Wood, ', 'Holly Hunter, ', 'Nikki Reed, ', 'Vanessa Hudgens', '']","A thirteen-year-old girl's relationship with her mother is put to the test as she discovers drugs, sex, and petty crime in the company of her cool but troubled best friend.",$4.60M,['Catherine Hardwicke']
Kaalkoot,Drama            ,,,8.7,"['Rohan Verma, ', 'Vijay Varma, ', 'Shweta Tripathi, ', 'Suzanna Mukherjee', '']","A police officer must deal with society's and his mother's pressure to marry, as well as frequent bullying and pressure from his superiors.","4,514",
Goliath,Drama            ,60 min,18+,8.1,"['Billy Bob Thornton, ', 'Nina Arianda, ', 'Tania Raymonde, ', 'Diana Hopper', '']","A disgraced lawyer, now an ambulance chaser, gets a case that could bring him redemption or at least revenge on the firm which expelled him.","51,684",
Living,Drama            ,102 min,PG-13,7.3,"['Bill Nighy, ', 'Aimee Lou Wood, ', 'Alex Sharp, ', 'Adrian Rawlins', '']","In 1950s London, a humorless bureaucrat decides to take time off work to experience life after receiving a grim diagnosis.","24,130",['Oliver Hermanus']
Pleasure,Drama            ,109 min,R,6.4,"['Sofia Kappel, ', 'Zelda Morrison, ', 'Evelyn Claire, ', 'Chris Cock', '']","Bella Cherry arrives in Los Angeles with dreams of becoming an adult film star, but she soon learns that fame won't come easy as she harnesses her ambition and cunning to rise to the top of this mesmerizing and singular world.","20,174",['Ninja Thyberg']
Suits,Drama            ,40 min,UA 16+,7.4,"['Asser Yassin, ', 'Ahmed Dawood, ', 'Mohamed Shahin, ', 'Saba Mubarak', '']","Within the framework of the drama, the series deals with the story of Adam, who by chance turns into a lawyer in a large law firm when he reveals his secret to lawyer Zain, and together the duo handle many thorny cases.",582,
Big Love,Drama            ,60 min,,7.7,"['Bill Paxton, ', 'Jeanne Tripplehorn, ', 'Chloë Sevigny, ', 'Ginnifer Goodwin', '']",A Utah polygamist who owns home improvement stores in the Salt Lake City area juggles relationships with three wives while trying to keep his complex family life from becoming a public scandal.,"22,649",
The Great Escaper,Drama            ,,,,"['Michael Caine, ', 'Glenda Jackson, ', 'John Standing, ', 'Laura Marcus', '']",Bernard Jordan escapes from his care home to attend the 70th Anniversary of the D-Day Landings in France.,,['Oliver Parker']
Close,Drama            ,104 min,PG-13,7.8,"['Eden Dambrine, ', 'Gustav De Waele, ', 'Émilie Dequenne, ', 'Léa Drucker', '']","The intense friendship between two thirteen-year old boys Leo and Remi suddenly gets disrupted. Struggling to understand what has happened, Léo approaches Sophie, Rémi's mother. ""Close"" is a film about friendship and responsibility.","25,996",['Lukas Dhont']
Fleishman Is in Trouble,Drama            ,48 min,A,7.7,"['Jesse Eisenberg, ', 'Claire Danes, ', 'Lizzy Caplan, ', 'Adam Brody', '']","Toby Fleishman knew what to expect when he and his wife of almost 15 years separated: weekends and every other holiday with the kids, some residual bitterness, and the occasional moment of tension in their co-parenting negotiations.","13,033",
Fire Country,Drama            ,44 min,,7.2,"['Max Thieriot, ', 'Kevin Alejandro, ', 'Jordan Calloway, ', 'Stephanie Arcila', '']",A young convict joins a firefighting program looking for redemption and a shortened prison sentence. He and other inmates work alongside elite firefighters to extinguish massive blazes across the region.,"6,563",
Knokke Off,Drama            ,,,7.7,"['Pommelien Thijs, ', 'Willem De Schryver, ', 'Eliyha Altena, ', 'Anna Drijver', '']","Follows a group of teenagers as they spend the summer at the Belgian seaside while searching for love, friendship and most importantly, for themselves.",568,
Reality,Drama            ,83 min,,6.7,"['Sydney Sweeney, ', 'Josh Hamilton, ', 'Marchánt Davis, ', 'Benny Elledge', '']",A former American intelligence specialist was given the longest sentence for the unauthorized release of government information to the media about Russian interference in the 2016 United States elections via an email operation.,"9,977",['Tina Satter']
The Son,Drama            ,123 min,PG-13,6.4,"['Vanessa Kirby, ', 'Felix Goddard, ', 'Max Goddard, ', 'Hugh Jackman', '']","Peter has his busy life with new partner Beth and their baby thrown into disarray when his ex-wife Kate turns up with their teenage son, Nicholas.","11,739",['Florian Zeller']
Scent of a Woman,Drama            ,156 min,UA,8,"['Al Pacino, ', ""Chris O'Donnell, "", 'James Rebhorn, ', 'Gabrielle Anwar', '']","A prep school student needing money agrees to ""babysit"" a blind man, but the job is not at all what he anticipated.",$63.90M,['Martin Brest']
Maid,Drama            ,545 min,18,8.4,"['Margaret Qualley, ', 'Nick Robinson, ', 'Rylea Nevaeh Whittet, ', 'Andie MacDowell', '']","After fleeing an abusive relationship, a young mother finds a job cleaning houses as she fights to provide for her child and build them a better future.","91,814",
Magnolia,Drama            ,188 min,UA,8,"['Tom Cruise, ', 'Jason Robards, ', 'Julianne Moore, ', 'Philip Seymour Hoffman', '']","An epic mosaic of interrelated characters in search of love, forgiveness and meaning in the San Fernando Valley.",$22.46M,['Paul Thomas Anderson']
An Cailín Ciúin,Drama            ,95 min,PG-13,7.7,"['Carrie Crowley, ', 'Andrew Bennett, ', 'Catherine Clinch, ', 'Michael Patric', '']","Rural Ireland 1981. A quiet, neglected girl is sent away from her dysfunctional family to live with foster parents for the summer. She blossoms in their care, but in this house where there are meant to be no secrets, she discovers one.","15,572",['Colm Bairéad']
Y tu mamá también,Drama            ,106 min,A,7.7,"['Maribel Verdú, ', 'Gael García Bernal, ', 'Daniel Giménez Cacho, ', 'Ana López Mercado', '']","In Mexico, two teenage boys and an attractive older woman embark on a road trip and learn a thing or two about life, friendship, sex, and each other.",$13.62M,['Alfonso Cuarón']
The Gilded Age,Drama            ,81 min,UA 13+,8,"['Ben Ahlers, ', 'Celia Keenan-Bolger, ', 'Debra Monk, ', ""Kelli O'Hara"", '']","A wide-eyed young scion of a conservative family embarks on a mission to infiltrate the wealthy neighboring clan dominated by ruthless railroad tycoon George Russell, his rakish son, Larry, and his ambitious wife, Bertha.","27,061",
Women Talking,Drama            ,104 min,PG-13,6.9,"['Rooney Mara, ', 'Claire Foy, ', 'Jessie Buckley, ', 'Frances McDormand', '']","Do nothing, stay and fight, or leave. In 2010, the women of an isolated religious community grapple with reconciling a brutal reality with their faith.","32,837",['Sarah Polley']
Jesus Revolution,Drama            ,120 min,PG-13,7.1,"['Joel Courtney, ', 'Jonathan Roumie, ', 'Kimberly Williams-Paisley, ', 'Anna Grace Barlow', '']",The true story of a national spiritual awakening in the early 1970s and its origins within a community of teenage hippies in Southern California.,"9,161",
Brothers & Sisters,Drama            ,60 min,UA,7.4,"['Dave Annable, ', 'Calista Flockhart, ', 'Rachel Griffiths, ', 'Ron Rifkin', '']",The story of the drama surrounding a family's adult siblings.,"24,871",
Moonlight,Drama            ,111 min,A,7.4,"['Mahershala Ali, ', 'Naomie Harris, ', 'Trevante Rhodes, ', 'Alex R. Hibbert', '']","A young African-American man grapples with his identity and sexuality while experiencing the everyday struggles of childhood, adolescence, and burgeoning adulthood.",$27.85M,['Barry Jenkins']
Portrait de la jeune fille en feu,Drama            ,122 min,18,8.1,"['Noémie Merlant, ', 'Adèle Haenel, ', 'Luàna Bajrami, ', 'Valeria Golino', '']","On an isolated island in Brittany at the end of the eighteenth century, a female painter is obliged to paint a wedding portrait of a young woman.",$3.76M,['Céline Sciamma']
Crash,Drama            ,100 min,Not Rated,6.4,"['James Spader, ', 'Holly Hunter, ', 'Elias Koteas, ', 'Deborah Kara Unger', '']","After getting into a serious car accident, a TV director discovers an underground sub-culture of scarred, omnisexual car-crash victims who use car accidents and the raw sexual energy they produce to try to rejuvenate his sex life with his wife.",$2.04M,['David Cronenberg']
Bones of Crows,Drama            ,124 min,,6.5,"['Grace Dove, ', 'Phillip Forest Lewitski, ', 'Rémy Girard, ', 'Karine Vanasse', '']","Cree code talker Aline Spears survives her traumatic past in Canada's residential school system to continue her family's generational fight against systemic starvation, racism and sexual abuse.",290,['Marie Clements']
Prisoner's Daughter,Drama            ,100 min,R,6.4,"['Sarah Anderson, ', 'Maynard Bagang, ', 'Kate Beckinsale, ', 'Christopher Convery', '']","A father fights for the love of his daughter and grandson, after serving twelve years in prison.",837,['Catherine Hardwicke']
Capharnaüm,Drama            ,126 min,A,8.4,"['Zain Al Rafeea, ', 'Yordanos Shiferaw, ', 'Boluwatife Treasure Bankole, ', 'Kawsar Al Haddad', '']","While serving a five-year sentence for a violent crime, a 12-year-old boy sues his parents for neglect.",$1.66M,['Nadine Labaki']
Dronningen,Drama            ,127 min,18,7.1,"['Trine Dyrholm, ', 'Gustav Lindh, ', 'Magnus Krepper, ', 'Liv Esmår Dannemann', '']",A successful lawyer jeopardizes her career and threatens to tear her family apart after engaging in an affair with her teenage stepson.,"13,033",['May el-Toukhy']
Midnight Cowboy,Drama            ,113 min,A,7.8,"['Dustin Hoffman, ', 'Jon Voight, ', 'Sylvia Miles, ', 'John McGiver', '']","A naive hustler travels from Texas to New York City to seek personal fortune, finding a new friend in the process.",$44.79M,['John Schlesinger']
Pieces of a Woman,Drama            ,126 min,18,7,"['Vanessa Kirby, ', 'Shia LaBeouf, ', 'Ellen Burstyn, ', 'Iliza Shlesinger', '']","When a young mother's home birth ends in unfathomable tragedy, she begins a year-long odyssey of mourning that fractures relationships with loved ones in this deeply personal story of a woman learning to live alongside her loss.","53,463",['Kornél Mundruczó']
Pearson,Drama            ,42 min,,6.8,"['Gina Torres, ', 'Bethany Joy Lenz, ', 'Simon Kassianides, ', 'Eli Goree', '']",Attorney Jessica Pearson enters the complex and seedy world of Chicago politics.,"2,501",
