movie,genre,runtime,certificate,rating,stars,description,votes,director
I Call First,Drama            ,90 min,,6.6,"['Harvey Keitel, ', 'Zina Bethune, ', 'Anne Collette, ', 'Lennard Kuras', '']",A young man can't accept the girl he likes because of her bitter past.,"9,601",['Martin Scorsese']
Bodies,Drama            ,60 min,,8.4,"['Tamzin Malleson, ', 'Max Beesley, ', 'Keith Allen, ', 'Patrick Baladi', '']","A young registrar, Rob Lake starts work under established gynecologist Roger Hurley whom he finds to be an affable man. All is not as it first appears, however, and Lake soon develops grave misgivings about his boss and his methods.","1,406",
Jungfrukällan,Drama            ,89 min,A,8.1,"['Max von Sydow, ', 'Birgitta Valberg, ', 'Gunnel Lindblom, ', 'Birgitta Pettersson', '']","In 14th-century Sweden, an innocent yet pampered teenage girl and her family's pregnant and jealous servant set out from their farm to deliver candles to church, but only one returns from events that transpire in the woods along the way.",$1.53M,['Ingmar Bergman']
Found,Drama            ,,,,"['Shanola Hampton, ', 'Azaria Carter, ', 'Bill Kelly, ', 'Sterling Jones', '']","Each year, over 600,000 people are reported missing in the U.S., but not all cases receive the proper attention. Gabi Mosely and her crisis management team make sure there is always someone looking out for the forgotten missing people.",,
House of Cards,Drama            ,226 min,,8.5,"['Ian Richardson, ', 'Susannah Harker, ', 'Miles Anderson, ', 'Alphonsia Emmanuel', '']",The schemes of a ruthlessly ambitious British politician who will stop at nothing to get to the top.,"14,783",
A Mother's Intuition,Drama            ,,,6.7,"['Denise Boutte, ', 'Tamar Braxton, ', 'Rachelle Carson-Begley, ', 'Matt Cedeño', '']",It tells the story of a sculptor and an investigator. They try to find her missing newborn and uncover a dark and fatal secret.,15,['Cas Sigers-Beedles']
The Outrun,Drama            ,,,,"['Saoirse Ronan, ', 'Paapa Essiedu, ', 'Stephen Dillane, ', 'Nabil Elouahabi', '']","Rona, fresh out of rehab, returns to the wild Orkney Islands after more than a decade away. As she reconnects with the dramatic landscape where she grew up, memories of her childhood merge ...                See full summary »
",,['Nora Fingscheidt']
Conviction,Drama            ,42 min,,7.1,"['Hayley Atwell, ', 'Eddie Cahill, ', 'Shawn Ashmore, ', 'Merrin Dungey', '']",A brilliant attorney and former First Daughter is blackmailed to heading a unit that investigates cases of wrongful conviction.,"7,573",
Les fruits de la passion,Drama            ,83 min,R,5.4,"['Klaus Kinski, ', 'Isabelle Illiers, ', 'Arielle Dombasle, ', 'Pîtâ', '']","A girl loves an older man. He demands that she goes in a brothel, as evidence that she loves him.","1,565",['Shûji Terayama']
"Signed, Sealed, Delivered: Home Again",Drama            ,87 min,,7.7,"['Eric Mabius, ', 'Kristin Booth, ', 'Yan-Kay Crystal Lowe, ', 'Geoff Gustafson', '']",The Postables discover a vase with a letter inside and must find the vase's owner. The vase's origin is suspicious and the Postables will have to decide whether to do what is right or what is legal.,972,['Kevin Fair']
Ghahreman,Drama            ,127 min,U,7.5,"['Amir Jadidi, ', 'Mohsen Tanabandeh, ', 'Sahar Goldoost, ', 'Fereshteh Sadre Orafaiy', '']","Rahim is in prison because of a debt he was unable to repay. During a two-day leave, he tries to convince his creditor to withdraw his complaint against the payment of part of the sum. But things don't go as planned.","27,649",['Asghar Farhadi']
Alba,Drama            ,50 min,A,6.4,"['Elena Rivera, ', 'Eric Masip, ', 'Álvaro Rico, ', 'Pol Hermoso', '']",A chain of events is kickstarted when a young girl is gang-raped by four boys.,"1,815",
O Fantasma,Drama            ,87 min,,5.7,"['Ricardo Meneses, ', 'Beatriz Torcato, ', 'Andre Barbosa, ', 'Eurico Vieira', '']","Young and handsome Sergio works the night shift as a trash collector in Lisbon, Portugal. He can't force himself to connect with his pretty female co-worker Fatima, who displays an avid ...                See full summary »
",$0.13M,['João Pedro Rodrigues']
Manderlay,Drama            ,139 min,,7.2,"['Bryce Dallas Howard, ', 'Isaach De Bankolé, ', 'Danny Glover, ', 'Willem Dafoe', '']","A story of slavery, set in the southern U.S. in the 1930s.",$0.08M,['Lars von Trier']
Take Me to the River,Drama            ,84 min,,6.2,"['Logan Miller, ', 'Robin Weigert, ', 'Josh Hamilton, ', 'Richard Schiff', '']",A Californian teenager's plan to come out at his Nebraskan family reunion gets derailed when a bloodstain on his young cousin's dress makes him the unwitting suspect of abuse.,"2,629",['Matt Sobel']
Gandu,Drama            ,85 min,(Banned),5.5,"['Anubrata Basu, ', 'Joyraj Bhattacharya, ', 'Rituparna Sen, ', 'Kamalika Banerjee', '']","After Nihilistic rapper Gandu steals from his mother's lover, he embarks on a drug-fueled rampage with a rickshaw puller in this abstract film.","2,647",['Qaushiq Mukherjee']
The Great Santini,Drama            ,115 min,PG,7.2,"['Robert Duvall, ', 'Blythe Danner, ', ""Michael O'Keefe, "", 'Lisa Jane Persky', '']","As he approaches manhood, Ben Meechum struggles to win the approval of his demanding alpha male father, an aggressively competitive, but frustrated Marine pilot.","6,752",['Lewis John Carlino']
Choir Girl,Drama            ,95 min,,4.1,"['Peter Flaherty, ', 'Krista Vendy, ', 'Jack Campbell, ', 'Sarah Timm', '']","Eugene, a lonely photographer, becomes fixated on a young street prostitute, Josephine, in his rundown neighborhood. She becomes his muse and his photographs could be a way out for both of them - yet is Eugene saving Josephine or is he using her?",134,['John Fraser']
Land Man,Drama            ,,,,"['Billy Bob Thornton, ', 'Michelle Randolph, ', 'Jacob Lofland', '']","Set in the proverbial boomtowns of West Texas, Land Man is a modern day tale of fortune seeking in the world of oil rigs. The series is an upstairs/downstairs story of roughnecks and ...                See full summary »
",,
The Teacher,Drama            ,60 min,,5.8,"['Sheridan Smith, ', 'Samuel Bottomley, ', 'Cecilia Noble, ', 'David Fleeshman', '']",An emotionally troubled teacher's life begins to fall apart as she faces accusations of sleeping with a student.,"2,365",
Good Sam,Drama            ,43 min,Not Rated,6,"['Sophia Bush, ', 'Jason Isaacs, ', 'Skye P. Marshall, ', 'Michael Stahl-David', '']",Follows a talented yet stifled surgeon who embraces her leadership role after her renowned and pompous boss falls into a coma.,"2,442",
In America,Drama            ,105 min,PG-13,7.7,"['Paddy Considine, ', 'Samantha Morton, ', 'Djimon Hounsou, ', 'Sarah Bolger', '']",A family of Irish immigrants adjust to life on the mean streets of Hell's Kitchen while also grieving the death of a child.,$15.54M,['Jim Sheridan']
Giant Little Ones,Drama            ,93 min,R,7.2,"['Josh Wiggins, ', 'Darren Mann, ', 'Taylor Hickson, ', 'Maria Bello', '']","Two popular teen boys, best friends since childhood, discover their lives, families, and girlfriends dramatically upended after an unexpected incident occurs on the night of a 17th birthday party.",$0.18M,['Keith Behrman']
Never Rarely Sometimes Always,Drama            ,101 min,PG-13,7.4,"['Sidney Flanigan, ', 'Talia Ryder, ', 'Théodore Pellerin, ', 'Eliazar Jimenez', '']",A pair of teenage girls in rural Pennsylvania travel to New York City to seek out medical help after an unintended pregnancy.,"30,075",['Eliza Hittman']
Moving On,Drama            ,45 min,,7.5,"['Neil Bell, ', 'Alicia Brockenbrow, ', 'John Draycott, ', 'Olivia Fenton', '']","Series of daytime plays set in contemporary Britain, all sharing the theme of someone going through some kind of life change.",486,
The Astronaut Wives Club,Drama            ,42 min,,7.3,"['JoAnna Garcia Swisher, ', 'Yvonne Strahovski, ', 'Dominique McElligott, ', 'Odette Annable', '']","Based on Lily Koppel's best-selling titular novel, which tells the real story of the women who stood beside some of the biggest heroes in American history during the height of the space race.","3,315",
Bastard Out of Carolina,Drama            ,98 min,Not Rated,7.3,"['Jennifer Jason Leigh, ', 'Ron Eldard, ', 'Glenne Headly, ', 'Lyle Lovett', '']",A mother and daughter find their lives adversely affected when a new man enters the picture. Will their family ever be what they expect?,"4,679",['Anjelica Huston']
One True Thing,Drama            ,127 min,U,6.9,"['Meryl Streep, ', 'Renée Zellweger, ', 'William Hurt, ', 'Tom Everett Scott', '']",A career woman reassesses her parents' lives after she is forced to care for her cancer-stricken mother.,$23.25M,['Carl Franklin']
La vita bugiarda degli adulti,Drama            ,50 min,A,6.4,"['Valeria Golino, ', 'Veronica Powers, ', 'Alessandro Preziosi, ', 'Giordana Marengo', '']","A girl in search of her true reflection in a divided Naples: the Naples of the heights, which assumes a mask of refinement, and the Naples of the depths, a place of excess and vulgarity.","1,432",
Ba jiao long zhong,Drama            ,117 min,,6.7,"['Baoqiang Wang, ', 'Yongsheng Chen, ', 'Andrew Derry, ', 'Max Grandi', '']",A former boxing champion takes decides to break a few rules and train orphans from China's remote countryside in order to give them a future.,143,['Baoqiang Wang']
"Madrid, 1987",Drama            ,105 min,,6.2,"['José Sacristán, ', 'María Valverde, ', 'Ramon Fontserè, ', 'Alberto Ferreiro', '']","Two characters: old and young; teacher and pupil; man and woman. Four walls within which they conjure intellectualism, relive the profession (journalism), explore politics and discover each other.","2,155",['David Trueba']
Gülcemal,Drama            ,124 min,,7.2,"['Murat Ünalmis, ', 'Melis Sezen, ', 'Edip Tepeli, ', 'Nilay Erdönmez', '']",Abandoned by his mother as a boy. A man years later vows to get revenge on the mom and her new family all while unknowingly falling in love with her adopted daughter.,"1,080",
Crossroads,Drama            ,30 min,,4.3,"['Noele Gordon, ', 'Roger Tonge, ', 'Susan Hanson, ', 'Anthony Morton', '']","The four-or-five-times-a-week adventures of a motel owner and her son, daughter and staff. Drama was never far away from the ringing of the reception bell.",396,
Fremont,Drama            ,91 min,,7.1,"['Anaita Wali Zada, ', 'Jeremy Allen White, ', 'Gregg Turkington, ', 'Hilda Schmelling', '']",Follow the woman who served as a translator for US troops in Afghanistan,132,['Babak Jalali']
The Last Black Man in San Francisco,Drama            ,121 min,16,7.3,"['Jimmie Fails, ', 'Jonathan Majors, ', 'Rob Morgan, ', 'Tichina Arnold', '']",A young man searches for home in the changing city that seems to have left him behind.,$4.52M,['Joe Talbot']
The Woodsman,Drama            ,87 min,R,7.2,"['Kevin Bacon, ', 'Kyra Sedgwick, ', 'Yasiin Bey, ', 'David Alan Grier', '']",A child molester returns to his hometown after 12 years in prison and attempts to start a new life.,$0.04M,['Nicole Kassell']
London's Burning,Drama            ,50 min,,7,"['Glen Murphy, ', 'Richard Walsh, ', 'Ben Onwukwe, ', 'Shirley Greenwood', '']",The lives of firefighters at Blackwall Fire Station.,885,
Kardeslerim,Drama            ,120 min,Not Rated,6,"['Celil Nalçakan, ', 'Cüneyt Mete, ', 'Fadik Sevin Atasoy, ', 'Ahu Yagtu', '']",4 siblings have to struggle with life after their parents' death.,"1,759",
The Slap,Drama            ,42 min,,6.2,"['Brian Cox, ', 'Melissa George, ', 'Lucas Hedges, ', 'Marin Ireland', '']",A once happy family suddenly begins to fall apart following a seemingly minor incident in which a man slaps another couple's misbehaving child.,"3,680",
Eureka,Drama            ,140 min,,6,"['Viggo Mortensen, ', 'Chiara Mastroianni, ', 'Viilbjørk Malling Agger, ', 'Rafi Pitts', '']",Murphy searches for his daughter after she is kidnapped by the outlaw Randall.,44,['Lisandro Alonso']
For Colored Girls,Drama            ,134 min,R,6.2,"['Janet Jackson, ', 'Anika Noni Rose, ', 'Whoopi Goldberg, ', 'Kimberly Elise', '']","Each of the women portray one of the characters represented in the collection of twenty poems, revealing different issues that impact women in general and women of color in particular.",$37.72M,['Tyler Perry']
Nurses,Drama            ,44 min,,6.1,"['Tiera Skovbye, ', 'Natasha Calis, ', 'Jordan Johnson-Hinds, ', 'Sandy Sidhu', '']","The series follows five young nurses working on the front lines of St. Mary's Hospital dedicating their lives to helping others, while figuring out how to help themselves.","2,186",
Ida,Drama            ,82 min,PG-13,7.4,"['Agata Kulesza, ', 'Agata Trzebuchowska, ', 'Dawid Ogrodnik, ', 'Jerzy Trela', '']",A novice nun about to take her vows uncovers a family secret dating back to the German occupation.,$3.83M,['Pawel Pawlikowski']
Tomboy,Drama            ,82 min,,7.4,"['Zoé Héran, ', 'Malonn Lévana, ', 'Jeanne Disson, ', 'Sophie Cattani', '']","A family moves into a new neighborhood, and a 10-year-old named Laure deliberately presents as a boy named Mikhael to the neighborhood children.",$0.13M,['Céline Sciamma']
The Emperor's Club,Drama            ,109 min,PG-13,6.9,"['Kevin Kline, ', 'Emile Hirsch, ', 'Joel Gretsch, ', 'Embeth Davidtz', '']",An idealistic prep school teacher attempts to redeem an incorrigible student.,$14.06M,['Michael Hoffman']
The Angry Silence,Drama            ,95 min,,7.2,"['Richard Attenborough, ', 'Pier Angeli, ', 'Michael Craig, ', 'Bernard Lee', '']",A young factory worker decides to stand up against his workmates and fellow union members when they want to hold a wildcat strike.,"1,615",['Guy Green']
En la cama,Drama            ,85 min,,6.2,"['Blanca Lewin, ', 'Gonzalo Valenzuela', '']","A young man and woman have a sensual, one-night stand in a motel room where they confide in each other about their troubled lives.","3,441",['Matías Bize']
The United States of Leland,Drama            ,108 min,R,7,"['Ryan Gosling, ', 'Don Cheadle, ', 'Kevin Spacey, ', 'Chris Klein', '']",A young man's experience in a juvenile detention center that touches on the tumultuous changes that befall his family and the community in which he lives.,$0.34M,['Matthew Ryan Hoge']
Blackout,Drama            ,,,7.6,"['Rami Malek, ', 'Chloe Brooks, ', 'Seychelle Gabriel, ', 'T.C. Carter', '']","Academy Award® winner Rami Malek stars in this apocalyptic thriller as a small-town radio DJ fighting to protect his family and community after the power grid goes down nationwide, upending...                See full summary »
",271,
The Sunset Limited,Drama            ,91 min,,7.3,"['Samuel L. Jackson, ', 'Tommy Lee Jones', '']","Through a chance encounter, two men of opposing ideologies deliberate spiritual, philosophical, and profound matters in a New York City apartment.","31,064",['Tommy Lee Jones']
The God Committee,Drama            ,98 min,,5.8,"['Kelsey Grammer, ', 'Julia Stiles, ', 'Colman Domingo, ', 'Janeane Garofalo', '']","An organ transplant committee has one hour to decide which of three patients deserves a life-saving heart. Seven years later, the committee members struggle with the consequences of that fateful decision.","4,405",['Austin Stark']
Cruel Intentions,Drama            ,45 min,,7.2,"['Nathalie Kelley, ', 'Sarah Michelle Gellar, ', 'Anne Winters, ', 'Peter Gallagher', '']","Fifteen years after the death of her brother, villainous Kathryn Merteuil seeks to manipulate her nephew, Bash, and gain control of the family business Valmont International.",510,['Roger Kumble']
David Copperfield,Drama            ,185 min,,7.7,"['Daniel Radcliffe, ', 'Trevor Eve, ', 'Pauline Quirke, ', 'Laura Harling', '']",A gentle orphan discovers life and love in an indifferent adult world.,"4,843",
Baisers cachés,Drama            ,87 min,,7.3,"['Patrick Timsit, ', 'Barbara Schulz, ', 'Bruno Putzulu, ', 'Bérenger Anceaux', '']","Nathan goes to a high school party and meets Louis. The two find themselves out of sight and kissing, but someone takes a photo of them. When the photo is placed online, a storm overtakes their lives.","4,789",['Didier Bivel']
Zemheri,Drama            ,120 min,Not Rated,7,"['Ayça Aysin Turan, ', 'Alperen Duymaz, ', 'Caner Cindoruk, ', 'Hazal Filiz Küçükköse', '']","Firuze and Ayaz. Two beautiful heart, two family carrying children overhead. Fate brought them together. Her father's unjust conviction in the elevator accident that killed thirteen people ...                See full summary »
","1,756",
Margaret,Drama            ,150 min,R,6.5,"['Anna Paquin, ', 'Matt Damon, ', 'Mark Ruffalo, ', 'J. Smith-Cameron', '']","A young woman witnesses a bus accident, and is caught up in the aftermath, where the question of whether or not it was intentional affects many people's lives.",$0.05M,['Kenneth Lonergan']
Günesi Beklerken,Drama            ,120 min,,6.8,"['Kerem Bürsin, ', 'Hande Dogandemir, ', 'Yagmur Tanrisevsin, ', 'Ismail Ege Sasmaz', '']","Looking for a better life, Demet tries to convince her only daughter Zeynep to leave their home village. They move into Demet's old friend's house Jale, and Zeynep is able to enroll at the ...                See full summary »
","3,573",
Young. Wild. Free.,Drama            ,105 min,,7.5,"['Algee Smith, ', 'Sierra Capri, ', 'Sanaa Lathan, ', 'Mike Epps', '']",A teenager struggling to provide for his younger siblings in Compton finds his life turned upside down when he's held at gunpoint by the girl of his dreams.,61,['Thembi Banks']
Ana de nadie,Drama            ,60 min,,8.6,"['Paola Turbay, ', 'Sebastián Carvajal, ', 'Jorge Enrique Abello, ', 'Laura Archbold', '']","Ana, a dedicated wife and mother, must reinvent her life after divorcing her philandering husband. When she meets and falls in love with a much younger man named Joaquín, her family and future change forever.",69,
The Virtues,Drama            ,47 min,,8.2,"['Stephen Graham, ', 'Niamh Algar, ', 'Helen Behan, ', 'Frank Laverty', '']","Falling into despair after his nine-year-old son leaves for Australia with his ex, Joseph walks away from his present life and boards a boat for Ireland to confront painful memories from his childhood.","6,339",
Don't Make Me Go,Drama            ,109 min,A,6.7,"['John Cho, ', 'Mia Isaac, ', 'Kaya Scodelario, ', 'Josh Thomson', '']","When a single father to a teenage daughter learns that he has a fatal brain tumor, he takes her on a road trip to find the mother who abandoned her years before and to try to teach her everything she might need over the rest of her life.","3,479",['Hannah Marks']
Doctor Thorne,Drama            ,48 min,,7.3,"['Harry Richardson, ', 'Tom Hollander, ', 'Stefanie Martini, ', 'Rebecca Front', '']","Penniless Mary Thorne grows up with her uncle, Doctor Thorne, and develops a friendship with the family at the nearby Greshamsbury Park estate.","5,029",
Baba,Drama            ,120 min,Not Rated,6.3,"['Haluk Bilginer, ', 'Tolga Saritas, ', 'Ayda Aksel, ', 'Özge Yagiz', '']","The life of Emin Saruhanli, who has been at odds with his brother Mehmet Ali for years, will be told that suddenly changed with the plane crash.",840,
Anne+,Drama            ,94 min,18,6.1,"['Hanna van Vliet, ', 'Jouman Fattal, ', 'Thorn de Vries, ', 'Jade Olieberg', '']","A twenty-something lesbian university graduate in Amsterdam prepares to leave for Montreal, meanwhile navigating her social life and writing carreer.","1,888",['Valerie Bisscheroux']
La scuola cattolica,Drama            ,106 min,A,5.7,"['Benedetta Porcaroli, ', 'Giulio Pranno, ', 'Emanuele Maria Di Stefano, ', 'Giulio Fochetti', '']","In late September 1975, a renowned Catholic school in Rome for sheltered, upper-middle-class boys is attacked in what became known as the Circeo Massacre. The film examines what triggered the violence.","3,232",['Stefano Mordini']
The Apostle,Drama            ,134 min,PG-13,7.2,"['Robert Duvall, ', 'Todd Allen, ', 'Paul Bagget, ', 'Lenore Banks', '']","After his happy life spins out of control, a preacher from Texas changes his name, goes to Louisiana and starts preaching on the radio.",$20.73M,['Robert Duvall']
Call Me Chihiro,Drama            ,131 min,UA 16+,6.9,"['Kasumi Arimura, ', 'Hana Toyoshima, ', 'Tetta Shimada, ', 'Van', '']","Chihiro works at a small beachside bento shop, Nokonoko Bento, and becomes a popular figure in the city.","2,495",['Rikiya Imaizumi']
Luden: Könige Der Reeperbahn,Drama            ,52 min,A,7,"['Aaron Hilmer, ', 'Jeanette Hain, ', 'Henning Flüsloh, ', 'Lena Urzendowsky', '']","The rise of Sonny Boy Klaus Barkowsky, who is made into a pimp by the tough prostitute Jutta and founds the 'Nutella' gang, which soon engages in a battle for power with the established 'GMBH.",937,
Soshite chichi ni naru,Drama            ,121 min,,7.8,"['Masaharu Fukuyama, ', 'Machiko Ono, ', 'Yôko Maki, ', 'Lily Franky', '']","Ryota is a successful workaholic businessman. When he learns that his biological son was switched with another boy after birth, he faces the difficult decision to choose his true son or the boy he and his wife have raised as their own.",$0.28M,['Hirokazu Koreeda']
The Last Tycoon,Drama            ,61 min,,7.6,"['Matt Bomer, ', 'Kelsey Grammer, ', 'Lily Collins, ', 'Dominique McElligott', '']","Centers on Hollywood's first wunderkind studio executive in the 1930s, Monroe Stahr, and the power struggle between him, his mentor, and current head of the studio, Pat Brady.","5,414",
Clean and Sober,Drama            ,124 min,,6.7,"['Michael Keaton, ', 'Kathy Baker, ', 'Morgan Freeman, ', 'Tate Donovan', '']",A hustling drug addict checks himself into rehabilitation to escape trouble with the law and realizes that it's exactly what he needs.,$8.67M,['Glenn Gordon Caron']
The Poker House,Drama            ,93 min,R,6.3,"['Jennifer Lawrence, ', 'Javon Johnson, ', 'Sophi Bairley, ', 'Bokeem Woodbine', '']",A dramatization of Lori Petty's teenage years spent in small town Iowa.,"5,698",['Lori Petty']
Kafas,Drama            ,,A,6.8,"['Sharman Joshi, ', 'Mona Singh, ', 'Zarina Wahab, ', 'Tejasvi Singh Ahlawat', '']","A middle-class family sees a brighter tomorrow when their son meets with a life-changing career opportunity. But this transition only unravels a web of trauma, raising poignant questions about wealth, power, and morality.",469,
Sundown,Drama            ,82 min,R,6.6,"['Tim Roth, ', 'Albertine Kotting McMillan, ', 'Samuel Bottomley, ', 'Charlotte Gainsbourg', '']","Neil and Alice Bennett are the core of a wealthy family on vacation in Mexico until a distant emergency cuts their trip short. When one relative disrupts the family's tight-knit order, simmering tensions rise to the fore.","5,683",['Michel Franco']
Anniversary,Drama            ,,,,"['Mckenna Grace, ', 'Diane Lane, ', 'Zoey Deutch, ', 'Kyle Chandler', '']","A close-knit family is torn apart as a new movement ""The Change"" envelops the country.",,['Jan Komasa']
Bu Sehir Arkandan Gelecek,Drama            ,120 min,,6.4,"['Kerem Bürsin, ', 'Gürkan Uygun, ', 'Leyla Lydia Tugutlu, ', 'Osman Alkas', '']","Rauf, who is working as a cook on cargo ships, adopts and raises Ali who witnessed his mother's death when he was 5 years old. They work on ships for 24 years together. Rauf was both mother...                See full summary »
","2,531",
Laurel Canyon,Drama            ,103 min,R,6.4,"['Frances McDormand, ', 'Alessandro Nivola, ', 'Christian Bale, ', 'Kate Beckinsale', '']","When an uptight young man and his fiancée move into his libertine mother's house, the resulting clash of life attitudes shakes everyone up.",$3.66M,['Lisa Cholodenko']
Mahjong Nights,Drama            ,111 min,,5.8,"['Angeli Khang, ', 'Sean De Guzman, ', 'Mickey Ferriols, ', 'Jay Manalo', '']",Alexa witnesses a simple mahjong night turned bloody when all the player's dark secrets are discovered - including Alexa's illicit affair with her stepfather.,758,['Lawrence Fajardo']
A Jazzman's Blues,Drama            ,127 min,A,6.7,"['Joshua Boone, ', 'Amirah Vann, ', 'Solea Pfeiffer, ', 'Austin Scott', '']","Follows an investigation into an unsolved murder unveiling a story full of forbidden love, deceit and a secret.","3,924",['Tyler Perry']
The Smell of Us,Drama            ,92 min,,4.8,"['Lukas Ionesco, ', 'Diane Rouxel, ', 'Théo Cholbi, ', 'Hugo Behar-Thinières', '']",A story centered around a group of self-destructive skateboarders in Paris.,"1,787",['Larry Clark']
The Village,Drama            ,60 min,,7.7,"['David Ryall, ', 'Maxine Peake, ', 'John Simm, ', 'Charlie Murphy', '']",Follows the residents of one English village across the 20th century and their turbulent lives.,"2,518",
The Death & Life of John F. Donovan,Drama            ,123 min,R,6.1,"['Kit Harington, ', 'Natalie Portman, ', 'Jacob Tremblay, ', 'Susan Sarandon', '']","A decade after the death of an American television star, a young actor reminisces about the written correspondence he shared with him, as well as the impact those letters had on both their lives.",$0.13M,['Xavier Dolan']
An Amish Sin,Drama            ,85 min,,6.7,"['Dylan Ratzlaff, ', 'Kellie Martin, ', 'Rukiya Bernard, ', 'Troy Mundle', '']",An Amish teenager tries to escape the harsh 18th-century-style lifestyle where she grew up to find her own voice and independence.,230,['Michael Nankin']
Ta'm e guilass,Drama            ,95 min,,7.7,"['Homayoun Ershadi, ', 'Abdolrahman Bagheri, ', 'Afshin Khorshid Bakhtiari, ', 'Safar Ali Moradi', '']",An Iranian man drives his car in search of someone who will quietly bury him under a cherry tree after he commits suicide.,$0.31M,['Abbas Kiarostami']
Palm Royale,Drama            ,,,,"['Kristen Wiig, ', 'Allison Janney, ', 'Leslie Bibb, ', 'Laura Dern', '']",Chronicles a woman reconstructing her identity in the 1960s after being dismissed by her husband and her entire social circle.,,
