movie,genre,runtime,certificate,rating,stars,description,votes,director
Black Narcissus,Drama            ,101 min,,7.7,"['Deborah Kerr, ', 'David Farrar, ', 'Flora Robson, ', 'Jenny Laird', '']","A group of nuns struggle to establish a convent in the Himalayas, while isolation, extreme weather, altitude, and culture clashes all conspire to drive the well-intentioned missionaries mad.","26,415",
À plein temps,Drama            ,88 min,,7.4,"['Laure Calamy, ', 'Anne Suarez, ', 'Geneviève Mnich, ', 'Nolan Arizmendi', '']","Just when Julie finally gets an interview for a job that will let her raise her children better, she runs into a national transit strike.","3,189",['Eric Gravel']
The Burial,Drama            ,126 min,R,,"['Jamie Foxx, ', 'Tommy Lee Jones, ', 'Bill Camp, ', 'Alan Ruck', '']","Inspired by true events, a lawyer helps a funeral home owner save his family business from a corporate behemoth, exposing a complex web of race, power, and injustice.",,['Maggie Betts']
Sátántangó,Drama            ,439 min,,8.2,"['Mihály Vig, ', 'Putyi Horváth, ', 'László feLugossy, ', 'Éva Almássy Albert', '']","On the eve of a large payment, residents of a collapsing collective farm see their plans turn into desolation when they discover that Irimiás, a former co-worker who they thought was dead, is returning to the community.","11,985",['Béla Tarr']
Twirl,Drama            ,59 min,,6.4,"['Bev Adams, ', 'Jennifer Aileen, ', 'Jill Anton, ', 'Bill Blont', '']",Some are addicted to drugs - Some Food - Some their career But then others are addicted to SEX.,10,['Joey Harlow']
Ragtime,Drama            ,155 min,,7.3,"['James Cagney, ', 'Elizabeth McGovern, ', 'Howard E. Rollins Jr., ', 'Brad Dourif', '']","A young black pianist becomes embroiled in the lives of an upper-class white family set among the racial tensions, infidelity, violence and other nostalgic events in early 1900s New York City.",$21.02M,['Milos Forman']
Juniper,Drama            ,94 min,,6.5,"['Charlotte Rampling, ', 'Marton Csokas, ', 'George Ferrier, ', 'Edith Poor', '']","When a self-destructive teenager is suspended from school and asked to look after his feisty alcoholic grandmother as a punishment, the crazy time they spend together turns his life around.","1,429",['Matthew J. Saville']
"Oslo, 31. august",Drama            ,95 min,,7.6,"['Anders Danielsen Lie, ', 'Hans Olav Brenner, ', 'Ingrid Olava, ', 'Malin Crépin', '']","One day in the life of Anders, a young recovering drug addict, who takes a brief leave from his treatment center to interview for a job and catch up with old friends in Oslo.",$0.10M,['Joachim Trier']
Dickensian,Drama            ,60 min,,7.6,"['Tuppence Middleton, ', 'Sophie Rundle, ', 'Alexandra Moen, ', 'Joseph Quinn', '']","Drama set within the fictional realms of Charles Dickens critically acclaimed novels, bringing together some of his most iconic characters as their lives intertwine in 19th century London.","3,753",
Sweetbitter,Drama            ,29 min,,7,"['Ella Purnell, ', 'Tom Sturridge, ', 'Evan Jonigkeit, ', 'Eden Epstein', '']",A young woman learns how crazy it is to work in a restaurant.,"4,777",
Kyss mig,Drama            ,105 min,,6.8,"['Ruth Vega Fernandez, ', 'Liv Mjönes, ', 'Krister Henriksson, ', 'Lena Endre', '']",A young woman engaged to be married finds herself in an affair with her soon-to-be stepmother's lesbian daughter.,"11,558",['Alexandra-Therese Keining']
Seven Veils,Drama            ,107 min,,,"['Amanda Seyfried, ', 'Douglas Smith, ', 'Rebecca Liddiard, ', 'Maia Jae Bastidas', '']","An earnest theater director has the task of remounting her former mentor's most famous work, the opera Salome. Some disturbing memories from her past will allow her repressed trauma to color the present.",,['Atom Egoyan']
The Unknown Country,Drama            ,85 min,,7.8,"['Lily Gladstone, ', 'Raymond Lee, ', 'Richard Ray Whitman, ', 'Lainey Bearkiller Shangreaux', '']",An unexpected invitation rushes a grieving young woman into a lonely road trip through the American Midwest towards the border between Texas and Mexico.,69,['Morrisa Maltz']
Baby the Rain Must Fall,Drama            ,100 min,,6.3,"['Lee Remick, ', 'Steve McQueen, ', 'Don Murray, ', 'Paul Fix', '']","In Texas, a woman and her young daughter head down to another town where the girl's irresponsible, hotheaded and immature father has just been released from prison on parole.","1,870",['Robert Mulligan']
Amanda,Drama            ,93 min,,6.6,"['Benedetta Porcaroli, ', 'Galatéa Bellugi, ', 'Giovanna Mezzogiorno, ', 'Michele Bravi', '']","Amanda, 24, lives mostly isolated and has never had any friends, even if it's the thing she wants the most. Amanda chooses as her new mission to convince her childhood friend that they are still best friends.",350,['Carolina Cavalli']
Birth of a MURDERER,Drama            ,87 min,,,"['Michael Bundy II, ', 'Emmy Robinson', '']","Birth of a MURDERER: A Black male college student falls haplessly in love with a white coed and discovers she isn't how she appears. Slowly but surely, he begins to unravel and the result is both shocking and perplexing.",,['Darian Lane']
Allelujah,Drama            ,99 min,,6,"['Jesse Akele, ', 'Louis Ashbourne Serkis, ', 'Lorraine Ashbourne, ', 'Jessica Baglow', '']",The story of a geriatric ward in a small Yorkshire hospital threatened with closure.,"1,008",['Richard Eyre']
All the World Is Sleeping,Drama            ,110 min,,5.3,"['Melissa Barrera, ', 'Jackie Cruz, ', 'Kristen Gutoskie, ', 'Luis Bordonada', '']","Fighting for her own life and the ones she loves, a Mother in New Mexico sinks deeper in her addiction while struggling to surface for her daughter.",202,['Ryan Lacen']
The Cobweb,Drama            ,134 min,,6.3,"['Richard Widmark, ', 'Lauren Bacall, ', 'Charles Boyer, ', 'Gloria Grahame', '']","At a private psychiatric clinic, the daily dramas and interactions between the doctors, nurses, administrators, benefactors and patients are accentuated by the personal and family crises of these individuals.","1,986",['Vincente Minnelli']
The Kite Runner,Drama            ,128 min,PG-13,7.6,"['Khalid Abdalla, ', 'Ahmad Khan Mahmoodzada, ', 'Atossa Leoni, ', 'Shaun Toub', '']","After spending years in California, Amir returns to his homeland in Afghanistan to help his old friend Hassan, whose son is in trouble.",$15.80M,['Marc Forster']
Mary Kills People,Drama            ,44 min,,7.5,"['Caroline Dhavernas, ', 'Jay Ryan, ', 'Richard Short, ', 'August Winter', '']","Single mother Mary Harris is an ER doctor by day, but by night she and her partner, a former plastic surgeon, moonlight as underground angels of death who help terminally ill patients slip away on their own terms.","4,487",
Minamata,Drama            ,115 min,R,7.2,"['Akiko Iwase, ', 'Kogarashi Wakasugi, ', 'Johnny Depp, ', 'Katherine Jenkins', '']",War photographer W. Eugene Smith travels back to Japan where he documents the devastating effect of mercury poisoning in coastal communities.,"21,892",['Andrew Levitas']
Marvellous,Drama            ,90 min,,7.8,"['Toby Jones, ', 'Gemma Jones, ', 'Tony Curran, ', 'Nicholas Gleaves', '']","The life of Neil Baldwin, a man who has shrugged off his perceived limitations to live an incredible life.","6,375",['Julian Farino']
AlRawabi School for Girls,Drama            ,291 min,UA 16+,7.3,"['Rakeen Saad, ', 'Noor Taher, ', 'Joanna Arida, ', 'Andria Tayeh', '']",The bullied outcasts at prestigious Al Rawabi School for Girls plot a series of risky takedowns to get back at their tormentors.,"6,681",
Falling,Drama            ,112 min,Not Rated,6.5,"['Viggo Mortensen, ', 'Lance Henriksen, ', 'Laura Linney, ', 'Terry Chen', '']","John Peterson lives with his partner Eric and their adopted daughter in Southern California. When he is visited by his aging father who is searching for a place to retire, their two very different worlds collide.","6,597",['Viggo Mortensen']
Peak Practice,Drama            ,50 min,,6.4,"['Gary Mavers, ', 'Simon Shepherd, ', 'Esther Coles, ', 'Margery Mason', '']",Beth Glover and Will Preston are doctors in partnership at a Derbyshire clinic when they hire Jack who's returned from Africa. The next several years deal with their personal and professional lives with Jack and Beth marrying.,470,
"The Long, Hot Summer",Drama            ,115 min,,7.3,"['Paul Newman, ', 'Joanne Woodward, ', 'Anthony Franciosa, ', 'Orson Welles', '']","Accused barn burner and conman Ben Quick arrives in a small Mississippi town and quickly ingratiates himself with its richest family, the Varners.","11,805",['Martin Ritt']
The Oval,Drama            ,60 min,,4.4,"['Ed Quinn, ', 'Kron Moore, ', 'Ptosha Storey, ', 'Vaughn W. Hebron', '']",Newly-elected U.S. President Hunter Franklin and his family move into the White House.,"1,648",
The New Pope,Drama            ,60 min,,8.1,"['Jude Law, ', 'John Malkovich, ', 'Silvio Orlando, ', 'Cécile de France', '']",Two Popes. Only one Vatican. A holy war to come.,"17,615",
Here,Drama            ,,,,"['Kelly Reilly, ', 'Tom Hanks, ', 'Robin Wright, ', 'Jonathan Aris', '']","Set in one single room, follows the many people who inhabit it over years and years, from the past to the future.",,['Robert Zemeckis']
Cake,Drama            ,102 min,R,6.4,"['Jennifer Aniston, ', 'Adriana Barraza, ', 'Anna Kendrick, ', 'Sam Worthington', '']","The acerbic, hilarious Claire Bennett becomes fascinated by the suicide of a woman in her chronic pain support group. As she uncovers the details of Nina's suicide and develops a poignant relationship with Nina's husband, she also grapples with her own, very raw personal tragedy.",$1.87M,['Daniel Barnz']
Sanglyusahoe,Drama            ,120 min,18,5.6,"['Park Hae-il, ', 'Soo Ae, ', 'Kim Gyu-Sun, ', 'Lee Jin-Wook', '']","A deputy curator of a chaebol-funded art gallery and her husband, a politically ambitious economics professor, will do anything to join the über-elite.","1,179",['Hyuk Byun']
Imitation of Life,Drama            ,125 min,,7.8,"['Lana Turner, ', 'John Gavin, ', 'Sandra Dee, ', 'Susan Kohner', '']",An aspiring white actress takes in an African American widow whose mixed-race daughter is desperate to be seen as white.,$13.99M,['Douglas Sirk']
"They Shoot Horses, Don't They?",Drama            ,129 min,A,7.8,"['Jane Fonda, ', 'Michael Sarrazin, ', 'Susannah York, ', 'Gig Young', '']",The lives of a disparate group of contestants intertwine in an inhumanely grueling dance marathon.,$12.60M,['Sydney Pollack']
RFDS,Drama            ,,,7.9,"['Emma Hamilton, ', 'Rob Collins, ', 'Stephen Peacocke, ', 'Justine Clarke', '']",RFDS is an Australian drama television series which centres around the lives of workers for the Royal Flying Doctor Service of Australia.,936,
The Visitor,Drama            ,104 min,PG-13,7.6,"['Richard Jenkins, ', 'Haaz Sleiman, ', 'Danai Gurira, ', 'Hiam Abbass', '']",A college professor travels to New York City to attend a conference and finds a young couple living in his apartment.,$9.42M,['Tom McCarthy']
White Oleander,Drama            ,109 min,UA,7.1,"['Michelle Pfeiffer, ', 'Renée Zellweger, ', 'Robin Wright, ', 'Alison Lohman', '']",A teenager journeys through a series of foster homes after her mother goes to prison for committing a crime of passion.,$16.35M,['Peter Kosminsky']
Titanic: Blood and Steel,Drama            ,55 min,,7.2,"['Kevin Zegers, ', 'Alessandra Mastronardi, ', 'Derek Jacobi, ', 'Billy Carter', '']","The construction of the R.M.S. Titanic at the Harland and Wolff shipyard in Belfast against the background of union riots, political and religious conflicts, and a romance between a young ambitious engineer and an Italian immigrant.","2,091",
The Old Oak,Drama            ,113 min,,7.3,"['Trevor Fox, ', 'Debbie Honeywood, ', 'Laura Lee Daly, ', 'Neil Leiper', '']","The future for the last remaining pub, The Old Oak in a village of the Northeast England, where people are leaving the land as the mines are closed. Houses are cheap and available thus making it an ideal location for the Syrian refugees.",86,['Ken Loach']
The Idea of You,Drama            ,,,,"['Anne Hathaway, ', 'Nicholas Galitzine, ', 'Reid Scott, ', 'Perry Mattfeld', '']","Solène Marchand (Anne Hathaway), a 40-year-old single mother, begins an unexpected romance with 24-year-old Hayes Campbell (Nicholas Galitzine), the lead singer of the hottest boy band on the planet, August Moon.",,['Michael Showalter']
Camdaki Kiz,Drama            ,120 min,Not Rated,5.5,"['Burcu Biricik, ', 'Selma Ergeç, ', 'Feyyaz Serifoglu, ', 'Enis Arikan', '']","Nalan is a beautiful young woman who earns everyone's love at first sight with her warmth. As the only child of the family enlarged hand baby, baby roses, lived in the existence of life and...                See full summary »
","1,329",
Saint Omer,Drama            ,122 min,PG-13,6.9,"['Kayije Kagame, ', 'Guslagie Malanda, ', 'Valérie Dréville, ', 'Aurélia Petit', '']","Follows Rama, a novelist who attends the trial of Laurence Coly at the Saint-Omer Criminal Court to use her story to write a modern-day adaptation of the ancient myth of Medea, but things don't go as expected.","3,474",['Alice Diop']
Los pacientes del doctor García,Drama            ,60 min,A,6.8,"['Javier Rey, ', 'Tamar Novas, ', 'Verónica Echegui, ', 'Eva Llorach', '']","Doctor Guillermo Garcia and Manuel Arroyo, a Republican diplomat infiltrate a clandestine network that helps Nazis settle in Spain and Latin America.",666,
The Toy Soldiers,Drama            ,143 min,R,5.4,"['Najarra Townsend, ', 'Constance Brenneman, ', 'Chandler Rylko, ', 'Jeanette May Steiner', '']","On one evening in a decade of sex, drugs and rock 'n' roll, the innocence of youth and family unravels. Five lives will change forever on this final evening before their hangout, The Toy Soldiers Roller Rink, closes its doors.","1,570",['Erik Peter Carlson']
Rare Objects,Drama            ,123 min,R,5.2,"['Julia Mayorga, ', 'Katie Holmes, ', 'Saundra Santiago, ', 'Candy Buckley', '']","""Rare Objects"" tells the story of a young woman who seeks to rebuild her life when she takes work at an antique store. She regains her confidence from the kind souls who own the shop, until those from her traumatic past begin to resurface.",209,['Katie Holmes']
Everything Must Go,Drama            ,97 min,R,6.4,"['Will Ferrell, ', 'Rebecca Hall, ', 'Christopher Jordan Wallace, ', 'Michael Peña', '']","When an alcoholic relapses, causing him to lose his wife and his job, he holds a yard sale on his front lawn in an attempt to start over. A new neighbor might be the key to his return to form.",$2.71M,['Dan Rush']
Mass,Drama            ,111 min,PG-13,7.6,"['Jason Isaacs, ', 'Martha Plimpton, ', 'Ann Dowd, ', 'Reed Birney', '']",The parents of both the shooter and one of the victims of a school shooting tragedy agree to meet and talk in an attempt to move forward.,"16,353",['Fran Kranz']
The Night of the Iguana,Drama            ,125 min,,7.6,"['Richard Burton, ', 'Ava Gardner, ', 'Deborah Kerr, ', 'Sue Lyon', '']",An ostracized Episcopal clergyman leads a busload of middle-aged Baptist women on a tour of the Mexican coast and comes to terms with the failure haunting his life.,$9.43M,['John Huston']
Promised Land,Drama            ,106 min,R,6.6,"['Matt Damon, ', 'Frances McDormand, ', 'John Krasinski, ', 'Hal Holbrook', '']","A salesman for a natural gas company experiences life-changing events after arriving in a small town, where his corporation wants to tap into the available resources.",$7.60M,['Gus Van Sant']
Cigare au miel,Drama            ,100 min,,6.1,"['Zoé Adjani, ', 'Amira Casar, ', 'Lyès Salem, ', 'Louis Peres', '']","Selma, 17, who lives in a bourgeois and secular Berber family. When she meets Julien in college, she realizes for the first time the impact of patriarchal rules on her intimacy.",642,['Kamir Aïnouz']
Sublime,Drama            ,100 min,,6.4,"['Martín Miller, ', 'Teo Inama Chiabrando, ', 'Azul Mazzeo, ', 'Joaquín Arana', '']","Manuel lives in a small coastal town. He plays bass in a band with his best friends. One of them is Felipe, with whom he shares a strong friendship. Unbreakable bond. Until the time comes to put it to test.",704,['Mariano Biasin']
Shtisel,Drama            ,45 min,13,8.6,"[""Doval'e Glickman, "", 'Michael Aloni, ', 'Neta Riskin, ', 'Shira Haas', '']","A Haredi family living in an ultra-Orthodox neighborhood of Jerusalem reckons with love, loss and the doldrums of daily life.","7,842",
The Romanoffs,Drama            ,60 min,16,7,"['Diane Lane, ', 'JJ Feild, ', 'Aaron Eckhart, ', 'Louise Bourgoin', '']",Anthology of eight stories about people who believe themselves to be descendant of the Russian Royal family.,"6,204",
X/Y,Drama            ,82 min,,4.2,"['Ryan Piers Williams, ', 'America Ferrera, ', 'Jon Paul Phillips, ', 'David Harbour', '']",A look at the lives and interactions of a group of friends living in New York.,682,['Ryan Piers Williams']
Marseille,Drama            ,41 min,18,6.9,"['Gérard Depardieu, ', 'Benoît Magimel, ', 'Géraldine Pailhas, ', 'Stéphane Caillard', '']","A tale of power, corruption and redemption set against the rich backdrop of the French port city of Marseille.","5,441",
Zalim Istanbul,Drama            ,120 min,18,5.7,"['Fikret Kuskan, ', 'Deniz Ugur, ', 'Ozan Dolunay, ', 'Sera Kutlubey', '']","Seher starts working at Agah Bey's house with her children. Curious love triangles form between the children of the two families, and the terrible secrets in the mansion begin to be revealed.","1,109",
Rivals,Drama            ,,,,"['David Tennant, ', 'Aidan Turner, ', 'Katherine Parkinson, ', 'Danny Dyer', '']",It follows Rupert Campbell-Black and Tony Baddingham as they have a longstanding rivalry that comes to a head.,,
The Company Men,Drama            ,104 min,R,6.7,"['Ben Affleck, ', 'Chris Cooper, ', 'Tommy Lee Jones, ', 'Suzanne Rico', '']","The story centers on a year in the life of three men trying to survive a round of corporate downsizing at a major company - and how that affects them, their families, and their communities.",$4.44M,['John Wells']
Berdreymi,Drama            ,123 min,,7.5,"['Birgir Dagur Bjarkason, ', 'Áskell Einar Pálmason, ', 'Viktor Benóný Benediktsson, ', 'Snorri Rafn Frímannsson', '']","Addi, a gifted boy raised by a clairvoyant mother, decides to adopt a bullied misfit into his gang of outsiders. Left to their own devices, the boys discover aggression, violence, loyalty, and love.","1,744",['Guðmundur Arnar Guðmundsson']
Marvin's Room,Drama            ,98 min,U,6.7,"['Meryl Streep, ', 'Leonardo DiCaprio, ', 'Diane Keaton, ', 'Robert De Niro', '']","After seventeen years, a fiercely independent woman and her rebellious son return home and together they turn the family she left behind upside down.",$12.78M,['Jerry Zaks']
Tori et Lokita,Drama            ,88 min,,7.1,"['Pablo Schils, ', 'Joely Mbundu, ', 'Alban Ukaj, ', 'Tijmen Govaerts', '']","From two-time Palme d'Or-winners Jean-Pierre and Luc Dardenne, Tori and Lokita is a heart-stopping thriller that casts an unflinching eye on the trials of the young and dispossessed.","2,189",
To Die For,Drama            ,100 min,,4,"['John Schneider, ', 'Cody McCarver, ', 'Quinton Aaron, ', 'Becky Andrews', '']",What can one man do to fight the intentional decay of the greatest country the world has ever known?,291,['John Schneider']
Kis Uykusu,Drama            ,196 min,,8.1,"['Haluk Bilginer, ', 'Melisa Sözen, ', 'Demet Akbag, ', 'Ayberk Pekcan', '']",A hotel owner and landlord in a remote Turkish village deals with conflicts within his family and a tenant behind on his rent.,$0.17M,['Nuri Bilge Ceylan']
Satisfaction,Drama            ,60 min,,7.3,"['Kestie Morassi, ', 'Madeleine West, ', 'Alison Whyte, ', 'Diana Glenn', '']","Set in a high-class brothel, this new series creates a hyper-reality in which the viewer is privy to the private lives and emotions of five beautiful young women.","1,429",
"Trapper John, M.D.",Drama            ,60 min,,6.6,"['Pernell Roberts, ', 'Brian Stokes Mitchell, ', 'Charles Siebert, ', 'Gregory Harrison', '']",The Korean War M*A*S*H unit veteran operates as Chief Surgeon in a major city hospital with his colleagues.,"2,115",
Ondskan,Drama            ,113 min,,7.7,"['Andreas Wilson, ', 'Henrik Lundström, ', 'Gustaf Skarsgård, ', 'Linda Zilliacus', '']","A teenage boy expelled from school for fighting arrives at a boarding school where the systematic bullying of younger students is encouraged as a means to maintain discipline, and decides to fight back.",$0.02M,['Mikael Håfström']
Nell,Drama            ,112 min,PG-13,6.5,"['Jodie Foster, ', 'Liam Neeson, ', 'Natasha Richardson, ', 'Richard Libertini', '']","In a remote woodland cabin, a small-town doctor discovers Nell - a beautiful young hermit-woman with many secrets.",$33.68M,['Michael Apted']
Si lo hubiera sabido,Drama            ,35 min,UA 16+,6.2,"['Salva Reina, ', 'Megan Montaner, ', 'Miquel Fernández, ', 'Irina Bravo', '']","Follow the story of a 30-year-old woman who, when feeling dissatisfied with her marriage and family life, finds herself sent back in time 10 years following a lunar eclipse.","1,236",
Import Export,Drama            ,141 min,,7,"['Ekateryna Rak, ', 'Lidiya Oleksandrivna Savka, ', 'Oksana Ivanivna Sklyarenko, ', 'Dmytro Andriyovich Gachkov', '']","A nurse from Ukraine searches for a better life in the West, while an unemployed security guard from Austria heads East for the same reason.","6,115",['Ulrich Seidl']
Blackbird,Drama            ,97 min,R,6.6,"['Sam Neill, ', 'Susan Sarandon, ', 'Anson Boon, ', 'Kate Winslet', '']",A terminally ill mother arranges to bring her family together one last time before she dies. A remake of the 2014 Danish film 'Silent Heart'.,"5,423",['Roger Michell']
The Heart Is Deceitful Above All Things,Drama            ,98 min,Not Rated,6.3,"['Asia Argento, ', 'Dylan Sprouse, ', 'Cole Sprouse, ', 'Jimmy Bennett', '']","Seven-year-old Jeremiah is pulled from his foster home and thrown into a troubled life on the road with his teenage mother, Sarah.",$0.03M,['Asia Argento']
A Family Man,Drama            ,108 min,R,6.5,"['Gerard Butler, ', 'Gretchen Mol, ', 'Alison Brie, ', 'Anupam Kher', '']","A headhunter whose life revolves around closing deals in a survival-of-the-fittest boiler room battles his top rival for control of their job placement company, but his dream of owning the company clashes with the needs of his family.","12,971",['Mark Williams']
Expecting Amish,Drama            ,88 min,,6.1,"['AJ Michalka, ', 'Jesse McCartney, ', 'Alyson Stoner, ', 'Cayden Boyd', '']","Expecting Amish on Lifetime tells the story of 18-year-old Hannah Yoder, who is ready to join the Amish Church and marry her boyfriend Samuel. But things change when she goes to Hollywood and gets a glimpse of the world beyond.",804,['Richard Gabai']
If I Can't,Drama            ,,,5.2,"['Mena Monroe, ', 'Tristin Fazekas, ', 'Crystal The Doll, ', 'Tonja Brown', '']","It tells the story of woman, who's in search for love after a tragedy and finds it in the hands of an abuser.",190,['Mena Monroe']
Dalva,Drama            ,83 min,,7.7,"['Zelda Samson, ', 'Alexis Manenti, ', 'Fanta Guirassy, ', 'Marie Denarnaud', '']","Dalva is 12, but she dresses and lives like a woman. One day, she's taken away from her house. Dumbfounded at first, she later meets Jayden, a social worker, and Samia, a teen with a temper. A new life seems to start for Dalva.",692,['Emmanuelle Nicot']
The Ballad of Jack and Rose,Drama            ,112 min,R,6.5,"['Daniel Day-Lewis, ', 'Catherine Keener, ', 'Camilla Belle, ', 'Ryan McDonald', '']",A father and daughter isolated on an island off the East Coast and living on a once-thriving commune grapple with the limits of family and sexuality.,$0.71M,['Rebecca Miller']
Vanity Fair,Drama            ,60 min,,7.3,"['Michael Palin, ', 'Olivia Cooke, ', 'Tom Bateman, ', 'Johnny Flynn', '']",An adaptation of the 1848 novel by William Makepeace Thackeray.,"5,399",
Ask Me Anything,Drama            ,100 min,,6,"['Britt Robertson, ', 'Molly Hagan, ', 'Andy Buckley, ', 'Robert Patrick', '']","A confused teenager writes a blog revealing her daily activities and secrets, advised to do so by her high school guidance counselor in lieu of moving on to her first year in college.","12,748",['Allison Burnett']
Skymed,Drama            ,44 min,16,6.4,"['Natasha Calis, ', 'Morgan Holmstrom, ', 'Praneet Akilla, ', 'Aason Nadjiwon', '']","Follows intense character journeys and high-stakes medical rescues, heartbreaks and tribulations of budding nurses and pilots flying air ambulances.","1,114",
The Boys in the Band,Drama            ,121 min,18,6.8,"['Jim Parsons, ', 'Zachary Quinto, ', 'Matt Bomer, ', 'Andrew Rannells', '']","At a birthday party in 1968 New York, a surprise guest and a drunken game leave seven gay friends reckoning with unspoken feelings and buried truths.","17,001",['Joe Mantello']
The Colour Room,Drama            ,108 min,,6.8,"['Phoebe Dynevor, ', 'Matthew Goode, ', 'Kerry Fox, ', 'Darci Shaw', '']",Clarice Cliff breaks the glass ceiling and revolutionizes the workplace at a pottery factory in 1920s England.,"1,407",['Claire McCarthy']
Piccoli fuochi,Drama            ,95 min,,5.6,"['Dino Jaksic, ', 'Valeria Golino, ', 'Carlotta Wittig, ', 'Mario Garriba', '']","Little boy Tommaso has several imaginary friends who like to play cruel pranks on the staff in his house. When new maid Mara arrives, Tommaso bonds with her, but his jealous imaginary friends devise the cruelest prank yet for her.",319,['Peter Del Monte']
